,datetime,username,content,display name,user description,verified,follower count,friends count,statuses count,favourites count,listed count,media count,location,protected,outlinks,tcooutlinks,reply count,retweet count,like count,quote count,lang,source,media,retweeted tweet,quoted tweet,mentioned users
99,2021-10-25 01:49:51+00:00,Vin______99,@faria_luler @noticiasnoipad @Rodrigoinvestir @CasagrandeEqi @lnunesjr Cita do meireiles não do Ilan Goldfajn.,.Vi 💀,,False,55,433,5108,16347,0,19,,False,[],[],1,0,1,0,pt,"<a href=""http://twitter.com/download/android"" rel=""nofollow"">Twitter for Android</a>",,,,"[User(username='faria_luler', id=1409264426172178433, displayname='farialuler 🇺🇦 🛴🛴🛴', rawDescription=None, renderedDescription=None, descriptionLinks=None, verified=None, created=None, followersCount=None, friendsCount=None, statusesCount=None, favouritesCount=None, listedCount=None, mediaCount=None, location=None, protected=None, link=None, profileImageUrl=None, profileBannerUrl=None, label=None), User(username='noticiasnoipad', id=384708585, displayname='Henrique Moraes', rawDescription=None, renderedDescription=None, descriptionLinks=None, verified=None, created=None, followersCount=None, friendsCount=None, statusesCount=None, favouritesCount=None, listedCount=None, mediaCount=None, location=None, protected=None, link=None, profileImageUrl=None, profileBannerUrl=None, label=None), User(username='Rodrigoinvestir', id=1106890656042151938, displayname='rodrigao.eth', rawDescription=None, renderedDescription=None, descriptionLinks=None, verified=None, created=None, followersCount=None, friendsCount=None, statusesCount=None, favouritesCount=None, listedCount=None, mediaCount=None, location=None, protected=None, link=None, profileImageUrl=None, profileBannerUrl=None, label=None), User(username='lnunesjr', id=80704314, displayname='Luiz Nunes', rawDescription=None, renderedDescription=None, descriptionLinks=None, verified=None, created=None, followersCount=None, friendsCount=None, statusesCount=None, favouritesCount=None, listedCount=None, mediaCount=None, location=None, protected=None, link=None, profileImageUrl=None, profileBannerUrl=None, label=None)]"
100,2021-10-25 00:37:25+00:00,politicasemfato,"‘Sim, foi sem convicção Roberto Jefferson, tanto que PERDI MEU APPOINTMENT. Aí me ligaram da UHealth e eu acabei indo, mas nada mudou na minha rotina. Continuo jogando meu poker com meus amigos e indo à academia, tudo igual’, esclareceu Ilan Goldfajn",PolíticasemFato,"Cansado de fake news viesadas, pagas por partidos políticos? Bem-vindo à PolíticasemFato, a primeira agência de fake news política 100% isenta e imparcial.",False,2777,60,78083,560,9,80,"Rua da Assembléia, 10",False,[],[],0,0,0,0,pt,"<a href=""http://twitter.com/politicasemfato"" rel=""nofollow"">politicasemfato</a>",,,,
101,2021-10-24 18:07:25+00:00,politicasemfato,"Paulo Guedes: ""ouvi atentamente os argumentos do Ilan Goldfajn sobre a criação da nova CPMF e são irrefutáveis. Vamos apresentar um projeto na semana que vem.""",PolíticasemFato,"Cansado de fake news viesadas, pagas por partidos políticos? Bem-vindo à PolíticasemFato, a primeira agência de fake news política 100% isenta e imparcial.",False,2777,60,78083,560,9,80,"Rua da Assembléia, 10",False,[],[],0,0,0,0,pt,"<a href=""http://twitter.com/politicasemfato"" rel=""nofollow"">politicasemfato</a>",,,,
102,2021-10-23 21:33:53+00:00,marceloaj,O nome desse elefante é Ilan Goldfajn por acaso?,Marcelo Meirellista,Economista. Instituições importam. Política. Flamengo. Companheiro da sra. @tostestais e papai da Olívia.,False,886,2703,55077,23589,7,1433,"Brasília, Brasil",False,[],[],0,0,3,0,pt,"<a href=""http://twitter.com/download/android"" rel=""nofollow"">Twitter for Android</a>",,,https://twitter.com/igoldfajn/status/1452025013117276164,
103,2021-10-22 21:00:28+00:00,lpozzobon,"@carlosefilho Você não citou Pérsio Árida, Pedro Malan, Henrique Meirelles, Arminio Fraga, Ilan Goldfajn e outros que eram bons, passaram por governos, ajudaram a melhorar o país, saíram dos governos, continuam bons e com reputação intacta, mostrando que os caras do seu post são ruins mesmo.",Luiz Pozzobon,"Engenheiro, avô, flamenguista, corredor, ciclista, carioca adotado que adora o Rio de Janeiro.",False,93,261,7765,29617,0,115,"Rio de Janeiro, Brazil",False,[],[],1,0,5,0,pt,"<a href=""http://twitter.com/download/iphone"" rel=""nofollow"">Twitter for iPhone</a>",,,,"[User(username='carlosefilho', id=770345407, displayname='Psor Carlos', rawDescription=None, renderedDescription=None, descriptionLinks=None, verified=None, created=None, followersCount=None, friendsCount=None, statusesCount=None, favouritesCount=None, listedCount=None, mediaCount=None, location=None, protected=None, link=None, profileImageUrl=None, profileBannerUrl=None, label=None)]"
104,2021-10-22 19:29:48+00:00,CLAURANZ,"@Boscardin Timaço, sem dúvida. O Ilan Goldfajn tb fez um baita trabalho no BC. Incluiria ele nesse meio.",Claudio,,False,355,618,17710,19608,2,118,,False,[],[],0,0,0,0,pt,"<a href=""https://mobile.twitter.com"" rel=""nofollow"">Twitter Web App</a>",,,,"[User(username='Boscardin', id=159995198, displayname=""🙌 .'."", rawDescription=None, renderedDescription=None, descriptionLinks=None, verified=None, created=None, followersCount=None, friendsCount=None, statusesCount=None, favouritesCount=None, listedCount=None, mediaCount=None, location=None, protected=None, link=None, profileImageUrl=None, profileBannerUrl=None, label=None)]"
105,2021-10-22 00:47:27+00:00,cjefgv,"A CJE-FGV tem o prazer de convidar Ilan Goldfajn, ex-presidente do Banco Central e atual diretor do FMI, para participar do painel Economia Global. https://t.co/9TmEfIgYub",CJE FGV,"Fundada em 2007 por alunos da escola de economia da FGV-SP, a CJE é primeira empresa júnior de mercado financeiro do Brasil",False,72,9,18,7,0,11,São Paulo,False,[],[],0,3,7,1,pt,"<a href=""http://twitter.com/download/iphone"" rel=""nofollow"">Twitter for iPhone</a>","[Photo(previewUrl='https://pbs.twimg.com/media/FCQ6oCgXoAEp0FO?format=jpg&name=small', fullUrl='https://pbs.twimg.com/media/FCQ6oCgXoAEp0FO?format=jpg&name=large', altText=None)]",,,
106,2021-10-21 14:02:26+00:00,SigefredoSouza,"A última vez que a Selic esteve em dois dígitos foi em julho de 2017, em meio ao processo de redução de juros iniciado pela gestão de Ilan Goldfajn no Banco Central.",Sigefredo Souza,🇧🇷🇧🇷🇧🇷,False,145,1800,80271,63981,1,817,Contagem - MG - Brasil,False,[],[],1,0,0,0,pt,"<a href=""https://mobile.twitter.com"" rel=""nofollow"">Twitter Web App</a>",,,,
107,2021-10-20 18:39:37+00:00,politicasemfato,"'Se eu compraria um carro usado de Sérgio Moro? Depende do preço, né?', explicou Ilan Goldfajn, em debate no CORECON",PolíticasemFato,"Cansado de fake news viesadas, pagas por partidos políticos? Bem-vindo à PolíticasemFato, a primeira agência de fake news política 100% isenta e imparcial.",False,2777,60,78083,560,9,80,"Rua da Assembléia, 10",False,[],[],0,0,1,0,pt,"<a href=""http://twitter.com/politicasemfato"" rel=""nofollow"">politicasemfato</a>",,,,
108,2021-10-17 10:07:20+00:00,politicasemfato,"""Ninguém mais aguenta essa indefinição"", afirma Ilan Goldfajn em sua conta no Orkut",PolíticasemFato,"Cansado de fake news viesadas, pagas por partidos políticos? Bem-vindo à PolíticasemFato, a primeira agência de fake news política 100% isenta e imparcial.",False,2777,60,78083,560,9,80,"Rua da Assembléia, 10",False,[],[],0,0,0,0,pt,"<a href=""http://twitter.com/politicasemfato"" rel=""nofollow"">politicasemfato</a>",,,,
109,2021-10-09 19:37:23+00:00,politicasemfato,"Ilan Goldfajn: ""A verdade é que o Banco Central está demorando para agir""",PolíticasemFato,"Cansado de fake news viesadas, pagas por partidos políticos? Bem-vindo à PolíticasemFato, a primeira agência de fake news política 100% isenta e imparcial.",False,2777,60,78083,560,9,80,"Rua da Assembléia, 10",False,[],[],1,0,2,0,pt,"<a href=""http://twitter.com/politicasemfato"" rel=""nofollow"">politicasemfato</a>",,,,
110,2021-10-07 23:50:39+00:00,FreireLula75,"@requiaooficial Ilan Goldfajn assume, guedes já está em hora extra.",#BrasildoAmor,,False,566,562,129884,140235,0,1,Brasil,False,[],[],0,0,0,0,pt,"<a href=""http://twitter.com/download/android"" rel=""nofollow"">Twitter for Android</a>",,,,"[User(username='requiaooficial', id=95253000, displayname='Roberto Requião', rawDescription=None, renderedDescription=None, descriptionLinks=None, verified=None, created=None, followersCount=None, friendsCount=None, statusesCount=None, favouritesCount=None, listedCount=None, mediaCount=None, location=None, protected=None, link=None, profileImageUrl=None, profileBannerUrl=None, label=None)]"
111,2021-10-06 01:01:16+00:00,marcosprestes,"@ArthurLira_ @jdoriajr Presidente Arthur Lira….. Faça a gentileza de pedir para o Sr. RCN trazer o dólar de volta pra R$ 3,50 como era na época do Ilan Goldfajn ? Ele precisa ter mais sensibilidade social também, não ? Convoque o Presidente do BC na CAE para explicar esse câmbio a R$ 5,50 !!!!!!",Marcos Prestes,"Bloqueado por @jairbolsonaro, @renancalheiros, @gleisi, @jdoriajr, @nicolasmaduro",False,495,685,8578,70886,3,1511,"São Paulo, Brasil",False,[],[],6,2,4,0,pt,"<a href=""http://twitter.com/download/iphone"" rel=""nofollow"">Twitter for iPhone</a>",,,,"[User(username='ArthurLira_', id=1086390169970884613, displayname='Arthur Lira', rawDescription=None, renderedDescription=None, descriptionLinks=None, verified=None, created=None, followersCount=None, friendsCount=None, statusesCount=None, favouritesCount=None, listedCount=None, mediaCount=None, location=None, protected=None, link=None, profileImageUrl=None, profileBannerUrl=None, label=None), User(username='jdoriajr', id=64706049, displayname='João Doria', rawDescription=None, renderedDescription=None, descriptionLinks=None, verified=None, created=None, followersCount=None, friendsCount=None, statusesCount=None, favouritesCount=None, listedCount=None, mediaCount=None, location=None, protected=None, link=None, profileImageUrl=None, profileBannerUrl=None, label=None)]"
112,2021-10-05 12:38:21+00:00,gandralf,"@LeoAversa Armínio Fraga e Ilan Goldfajn fora presidentes do banco central.
Meirelles também, além de ministro da economia.
Todos ricos. Todos fizeram um bom trabalho.
Todos, aposto, tinham grana no exterior.
Não é uma questão de “SE”, mas uma questão é “COMO”.",gandralf,"Komm, süsser Tod",False,330,85,41718,45643,5,6173,São Paulo,False,[],[],1,0,0,0,pt,"<a href=""http://twitter.com/#!/download/ipad"" rel=""nofollow"">Twitter for iPad</a>",,,,"[User(username='LeoAversa', id=111754442, displayname='Leo Aversa', rawDescription=None, renderedDescription=None, descriptionLinks=None, verified=None, created=None, followersCount=None, friendsCount=None, statusesCount=None, favouritesCount=None, listedCount=None, mediaCount=None, location=None, protected=None, link=None, profileImageUrl=None, profileBannerUrl=None, label=None)]"
113,2021-10-03 15:16:53+00:00,jusnaturalista,"@Ideias_Radicais Irresponsável desde o Ilan Goldfajn, diga-se de passagem.",Emanuel 🇺🇦,"Politics, Games, Linux and some other stuff",False,146,386,8520,7268,6,105,Brazil,False,[],[],0,0,0,0,pt,"<a href=""https://mobile.twitter.com"" rel=""nofollow"">Twitter Web App</a>",,,,"[User(username='Ideias_Radicais', id=33262157, displayname='Raphaël Lima', rawDescription=None, renderedDescription=None, descriptionLinks=None, verified=None, created=None, followersCount=None, friendsCount=None, statusesCount=None, favouritesCount=None, listedCount=None, mediaCount=None, location=None, protected=None, link=None, profileImageUrl=None, profileBannerUrl=None, label=None)]"
114,2021-10-02 12:07:18+00:00,politicasemfato,"'No Brasil, temos que lutar contra o coronavírus e contra o vírus do autoritarismo', Ilan Goldfajn em post em seu perfil do Twitter.",PolíticasemFato,"Cansado de fake news viesadas, pagas por partidos políticos? Bem-vindo à PolíticasemFato, a primeira agência de fake news política 100% isenta e imparcial.",False,2777,60,78083,560,9,80,"Rua da Assembléia, 10",False,[],[],0,0,0,0,pt,"<a href=""http://twitter.com/politicasemfato"" rel=""nofollow"">politicasemfato</a>",,,,
115,2021-09-28 23:32:16+00:00,eigentoad,eu adoro a extrema especificidade do meme do ex presidente do BC Ilan Goldfajn dançando Jackson 5,autosapo,"Chief Train Officer @ MR Institute; café enjoyer, cuscuz truther; metade sapo metade Corinthians",False,1877,3787,83029,298584,4,4764,~/,False,[],[],3,0,16,0,pt,"<a href=""http://twitter.com/download/android"" rel=""nofollow"">Twitter for Android</a>",,,,
116,2021-09-28 20:39:30+00:00,politicasemfato,"Ilan Goldfajn: 'O que move o ser humano não são os deadlines, mas sim a vontade de urinar'",PolíticasemFato,"Cansado de fake news viesadas, pagas por partidos políticos? Bem-vindo à PolíticasemFato, a primeira agência de fake news política 100% isenta e imparcial.",False,2777,60,78083,560,9,80,"Rua da Assembléia, 10",False,[],[],0,2,10,0,pt,"<a href=""http://twitter.com/politicasemfato"" rel=""nofollow"">politicasemfato</a>",,,,
117,2021-09-27 21:37:19+00:00,politicasemfato,"Ilan Goldfajn: “Depois de muito resistir, comprei uma AirFryer. Não é que o troço é bom, mesmo?""",PolíticasemFato,"Cansado de fake news viesadas, pagas por partidos políticos? Bem-vindo à PolíticasemFato, a primeira agência de fake news política 100% isenta e imparcial.",False,2777,60,78083,560,9,80,"Rua da Assembléia, 10",False,[],[],0,0,0,0,pt,"<a href=""http://twitter.com/politicasemfato"" rel=""nofollow"">politicasemfato</a>",,,,
118,2021-09-27 00:41:49+00:00,CDPP_SP,"Ilan Goldfajn @igoldfajn, diretor do @CDPP_SP, foi conhecer os projetos da @fasamazonia 

#sustainability",Centro de Debate de Políticas Públicas,Grupo multidisciplinar de associados que realiza debates e elabora estudos sobre os desafios do país,False,4983,57,2639,3481,39,95,"São Paulo, Brasil",False,[],[],0,0,13,0,pt,"<a href=""http://twitter.com/download/android"" rel=""nofollow"">Twitter for Android</a>",,,https://twitter.com/igoldfajn/status/1442273351892832260,"[User(username='igoldfajn', id=40690416, displayname='Ilan Goldfajn', rawDescription=None, renderedDescription=None, descriptionLinks=None, verified=None, created=None, followersCount=None, friendsCount=None, statusesCount=None, favouritesCount=None, listedCount=None, mediaCount=None, location=None, protected=None, link=None, profileImageUrl=None, profileBannerUrl=None, label=None), User(username='CDPP_SP', id=1098942398418378753, displayname='Centro de Debate de Políticas Públicas', rawDescription=None, renderedDescription=None, descriptionLinks=None, verified=None, created=None, followersCount=None, friendsCount=None, statusesCount=None, favouritesCount=None, listedCount=None, mediaCount=None, location=None, protected=None, link=None, profileImageUrl=None, profileBannerUrl=None, label=None), User(username='fasamazonia', id=46627824, displayname='Fundação Amazônia Sustentável', rawDescription=None, renderedDescription=None, descriptionLinks=None, verified=None, created=None, followersCount=None, friendsCount=None, statusesCount=None, favouritesCount=None, listedCount=None, mediaCount=None, location=None, protected=None, link=None, profileImageUrl=None, profileBannerUrl=None, label=None)]"
119,2021-09-25 09:07:18+00:00,politicasemfato,Luiza Trajano nega ter presenciado defesa de doutorado de Ilan Goldfajn em Harvard.,PolíticasemFato,"Cansado de fake news viesadas, pagas por partidos políticos? Bem-vindo à PolíticasemFato, a primeira agência de fake news política 100% isenta e imparcial.",False,2777,60,78083,560,9,80,"Rua da Assembléia, 10",False,[],[],0,0,0,0,pt,"<a href=""http://twitter.com/politicasemfato"" rel=""nofollow"">politicasemfato</a>",,,,
120,2021-09-24 22:01:32+00:00,pedrobfeitoza,"Pra ficar ideal podia trocar o Temer pelo Ilan Goldfajn, mas td bem",Pedro Feitoza,Historian & Lecturer in Latin American Christianity @UoEDivinity | @EdinburghUni,False,326,565,1324,5979,4,98,"Edinburgh, Scotland",False,[],[],0,0,1,0,pt,"<a href=""http://twitter.com/download/iphone"" rel=""nofollow"">Twitter for iPhone</a>",,,,
121,2021-09-21 19:39:53+00:00,matheuslinardd,"@LucianoCOES @Felippe_Hermes O parabéns não foi pra mim, mas pro ex-presidente do BACEN quando você tinha 13 anos, Ilan Goldfajn. Pelo visto não estudou sobre o governo Temer, não é mesmo? Como eu disse, é o mal do jovem.",Matheus Linard 💡,Um cearense apaixonado por educação e inovação. Liberal por inteiro.,False,1734,738,5078,2969,5,192,"Juazeiro do Norte, Brasil",False,[],[],1,0,0,0,pt,"<a href=""http://twitter.com/download/iphone"" rel=""nofollow"">Twitter for iPhone</a>",,,,"[User(username='LucianoCOES', id=1294396900582608896, displayname='Luciano', rawDescription=None, renderedDescription=None, descriptionLinks=None, verified=None, created=None, followersCount=None, friendsCount=None, statusesCount=None, favouritesCount=None, listedCount=None, mediaCount=None, location=None, protected=None, link=None, profileImageUrl=None, profileBannerUrl=None, label=None), User(username='Felippe_Hermes', id=2324619756, displayname='Felippe Hermes', rawDescription=None, renderedDescription=None, descriptionLinks=None, verified=None, created=None, followersCount=None, friendsCount=None, statusesCount=None, favouritesCount=None, listedCount=None, mediaCount=None, location=None, protected=None, link=None, profileImageUrl=None, profileBannerUrl=None, label=None)]"
122,2021-09-18 23:24:34+00:00,jusnaturalista,"@Phill_Liep @Gabrielmg_teo77 Desastre que começou com Temer e Ilan Goldfajn. O que vai eleger o PT é a falta de bom senso desses ""liberais"" que gostam de baixar juros na marra.",Emanuel 🇺🇦,"Politics, Games, Linux and some other stuff",False,146,386,8520,7268,6,105,Brazil,False,[],[],1,0,2,0,pt,"<a href=""http://twitter.com/download/android"" rel=""nofollow"">Twitter for Android</a>",,,,"[User(username='Phill_Liep', id=893197404601712642, displayname='Pelifi', rawDescription=None, renderedDescription=None, descriptionLinks=None, verified=None, created=None, followersCount=None, friendsCount=None, statusesCount=None, favouritesCount=None, listedCount=None, mediaCount=None, location=None, protected=None, link=None, profileImageUrl=None, profileBannerUrl=None, label=None), User(username='Gabrielmg_teo77', id=904224563906662400, displayname='Gabriel oliveira', rawDescription=None, renderedDescription=None, descriptionLinks=None, verified=None, created=None, followersCount=None, friendsCount=None, statusesCount=None, favouritesCount=None, listedCount=None, mediaCount=None, location=None, protected=None, link=None, profileImageUrl=None, profileBannerUrl=None, label=None)]"
123,2021-09-18 23:11:53+00:00,Josie_Melo,"⁦@igoldfajn⁩ Ilan Goldfajn afirma que a ampliação do Bolsa Família deveria partir de uma revisão estrutural de gastos no Orçamento. “A solução (aumento IOF) é ruim, é ineficiente, vai dificultar o crescimento, dificultar a agenda do BC, que é de mais eficiência”, @Estadao https://t.co/LO8vVrDgQQ",Josie Melo 🇧🇷ela é nossa,"Economia, Política e informações",False,4805,1927,98587,137398,42,18005,Brasil,False,[],[],2,9,26,1,pt,"<a href=""http://twitter.com/download/iphone"" rel=""nofollow"">Twitter for iPhone</a>","[Photo(previewUrl='https://pbs.twimg.com/media/E_moR-XWUAQDYZc?format=jpg&name=small', fullUrl='https://pbs.twimg.com/media/E_moR-XWUAQDYZc?format=jpg&name=large', altText=None)]",,,"[User(username='igoldfajn', id=40690416, displayname='Ilan Goldfajn', rawDescription=None, renderedDescription=None, descriptionLinks=None, verified=None, created=None, followersCount=None, friendsCount=None, statusesCount=None, favouritesCount=None, listedCount=None, mediaCount=None, location=None, protected=None, link=None, profileImageUrl=None, profileBannerUrl=None, label=None), User(username='Estadao', id=9317502, displayname='Estadão 🗞️', rawDescription=None, renderedDescription=None, descriptionLinks=None, verified=None, created=None, followersCount=None, friendsCount=None, statusesCount=None, favouritesCount=None, listedCount=None, mediaCount=None, location=None, protected=None, link=None, profileImageUrl=None, profileBannerUrl=None, label=None)]"
124,2021-09-17 20:16:06+00:00,CDPP_SP,"Ilan Goldfajn @igoldfajn sobre o aumento do IOF: ""É uma solução ruim e ineficiente"".

Na @GloboNews
  https://t.co/dEwp79rDV3",Centro de Debate de Políticas Públicas,Grupo multidisciplinar de associados que realiza debates e elabora estudos sobre os desafios do país,False,4983,57,2639,3481,39,95,"São Paulo, Brasil",False,['https://g1.globo.com/globonews/globonews-em-ponto/video/ilan-goldfajn-sobre-aumento-do-iof-e-uma-solucao-ruim-e-ineficiente-9866766.ghtml'],['https://t.co/dEwp79rDV3'],0,10,93,0,pt,"<a href=""http://twitter.com/download/android"" rel=""nofollow"">Twitter for Android</a>",,,,"[User(username='igoldfajn', id=40690416, displayname='Ilan Goldfajn', rawDescription=None, renderedDescription=None, descriptionLinks=None, verified=None, created=None, followersCount=None, friendsCount=None, statusesCount=None, favouritesCount=None, listedCount=None, mediaCount=None, location=None, protected=None, link=None, profileImageUrl=None, profileBannerUrl=None, label=None), User(username='GloboNews', id=142393421, displayname='GloboNews', rawDescription=None, renderedDescription=None, descriptionLinks=None, verified=None, created=None, followersCount=None, friendsCount=None, statusesCount=None, favouritesCount=None, listedCount=None, mediaCount=None, location=None, protected=None, link=None, profileImageUrl=None, profileBannerUrl=None, label=None)]"
125,2021-09-17 19:00:00+00:00,EstadaoEconomia,"Para Felipe Salto, da IFI, e Ilan Goldfajn, ex-presidente do Banco Central, medida não é a solução para o pagamento do novo Bolsa Família no ano que vem - https://t.co/cZxhqVmFTx https://t.co/WMC3X9vzNJ",Economia Estadão,Twitter do site Economia & Negócios do Estadão,True,441584,128,45962,36,2736,22109,,False,['http://bit.ly/3klr4KG'],['https://t.co/cZxhqVmFTx'],0,1,1,0,pt,"<a href=""https://mobile.twitter.com"" rel=""nofollow"">Twitter Web App</a>","[Photo(previewUrl='https://pbs.twimg.com/media/E_gTEI_WYAYkfll?format=jpg&name=small', fullUrl='https://pbs.twimg.com/media/E_gTEI_WYAYkfll?format=jpg&name=large', altText=None)]",,,
126,2021-09-17 14:44:26+00:00,br_economico,"'Solução ruim, ineficiente e dificulta crescimento', diz Ilan Goldfajn sobre IOF → https://t.co/aGH0plp4fq",Brasil Econômico,"Twitter oficial do Brasil Econômico, a editoria de Economia do Portal @iG. Acompanhe as principais notícias do dia! Telegram: t.me/iGBrasilEconom…",True,155961,432,90109,368,910,12490,"São Paulo, Brasil",False,['http://economia.ig.com.br/2021-09-17/ilan-goldfajn-eumento-iof.html'],['https://t.co/aGH0plp4fq'],0,2,4,0,pt,"<a href=""https://mobile.twitter.com"" rel=""nofollow"">Twitter Web App</a>",,,,
127,2021-09-17 12:11:58+00:00,GloboNews,"Para o presidente do Conselho do Credit Suisse no Brasil e ex-presidente do Banco Central, Ilan Goldfajn, a decisão de aumentar o IOF é ineficiente e pode dificultar o desenvolvimento econômico: https://t.co/0JgtqowfQ4 #GloboNews",GloboNews,Nunca desliga,True,5569764,114,172488,320,8307,54237,Brasil,False,['https://glo.bo/3ErjCpm'],['https://t.co/0JgtqowfQ4'],11,8,75,1,pt,"<a href=""https://mobile.twitter.com"" rel=""nofollow"">Twitter Web App</a>",,,,
128,2021-09-17 10:02:44+00:00,juliaduailibi,"- Entrevista com Sylvia Steiner, ex juiza do Tribunal Penal Internacional
- Não tinha acordo? Alexandre de Moraes vota pela suspensão de portaria do governo sobre armas
- Rosana Ritchmann e suspensão da vacinação adolescente
- Ilan Goldfajn e IOF maior p bancar novo BolsaFamilia",Julia Duailibi,Comentarista de política e economia da GloboNews,True,247620,1926,9435,18840,958,248,,False,[],[],5,13,289,0,pt,"<a href=""http://twitter.com/download/iphone"" rel=""nofollow"">Twitter for iPhone</a>",,,,
129,2021-09-16 19:09:27+00:00,politicasemfato,Ilan Goldfajn: 'Quem sobe no pedestal do intelecto não se comunica com quem está na rua',PolíticasemFato,"Cansado de fake news viesadas, pagas por partidos políticos? Bem-vindo à PolíticasemFato, a primeira agência de fake news política 100% isenta e imparcial.",False,2777,60,78083,560,9,80,"Rua da Assembléia, 10",False,[],[],0,0,1,0,pt,"<a href=""http://twitter.com/politicasemfato"" rel=""nofollow"">politicasemfato</a>",,,,
130,2021-09-15 20:59:43+00:00,tropeceinomundo,"@riico_porto E os ministros? Se eu pudesse seria esse timaço:
Economia-Ilan Goldfajn
Planejamento-Gustavo Franco
Minas e Energia-Henrique Meirelles
Infraestrutura-João Amoedo
Cidades-Felipe Rigoni
Saúde-Natalia Pasternak
Casa Civil-Luiza Trajano
Relações Exter.-João Dória
👇",Serumaninho,"Cidadão Brasileiro. Não sou nenhum '...ista', nem torcedor de político. Só quero um país decente, com trabalho digno, educação, segurança e saúde de 1º mundo.",False,82,224,831,780,0,29,"São Paulo, Brasil",False,[],[],1,0,0,0,pt,"<a href=""http://twitter.com/download/android"" rel=""nofollow"">Twitter for Android</a>",,,,"[User(username='riico_porto', id=1055567244619669506, displayname='Ricardo 🚀🔰', rawDescription=None, renderedDescription=None, descriptionLinks=None, verified=None, created=None, followersCount=None, friendsCount=None, statusesCount=None, favouritesCount=None, listedCount=None, mediaCount=None, location=None, protected=None, link=None, profileImageUrl=None, profileBannerUrl=None, label=None)]"
