,datetime,username,content,display name,user description,verified,follower count,friends count,statuses count,favourites count,listed count,media count,location,protected,outlinks,tcooutlinks,reply count,retweet count,like count,quote count,lang,source,media,retweeted tweet,quoted tweet,mentioned users
821,2011-04-04 12:20:06+00:00,jrorlandini,"Notícias -&gt;&gt; Projeção para inflação continua em alta, mostra boletim Focus http://bit.ly/fhTdJH www.jrorlandini.net",Ricardo Orlandini,"Radialista, Administrador de Empresas, Comentarista de Rádio e TV. Também é editor do site RicardoOrlandini.net.",False,25543,24803,185279,89,233,2319,"Viamão, RS, Brazil",False,[],[],0,0,0,0,pt,"<a href=""http://twitterfeed.com"" rel=""nofollow"">twitterfeed</a>",,,,
822,2011-04-04 12:20:06+00:00,filipeschitino,"Projeção para inflação continua em alta, mostra boletim Focus:  http://bit.ly/f1jw6V",Filipe Schitino,e-mail: fschitino.jus@gmail.com,False,334,582,98619,856,18,48,"Rio das Ostras, RJ",False,[],[],0,0,0,0,pt,"<a href=""http://twitterfeed.com"" rel=""nofollow"">twitterfeed</a>",,,,
823,2011-04-04 12:19:13+00:00,em_economia,"Mercado prevê inflação acima de 6% para este ano, revela Boletim Focus. http://ow.ly/4swRt",Economia - em.com.br,,False,806,57,8019,0,10,0,,False,[],[],0,0,0,0,pt,"<a href=""http://www.hootsuite.com"" rel=""nofollow"">Hootsuite</a>",,,,
824,2011-04-04 12:17:45+00:00,nadiakel8,"Valor Econômico: IPCA deve avançar 6,02% em 2011, diz boletim Focus. http://is.gd/HL4e8R",Nadia de Oliveira,Nunca desisto enquanto respiro...,False,309,1503,4876,168,2,9,Brasil,False,[],[],0,0,0,0,pt,"<a href=""http://twitter.com"" rel=""nofollow"">Twitter Web Client</a>",,,,
825,2011-04-04 12:13:55+00:00,flavioarantesbr,"Valor Econômico: IPCA deve avançar 6,02% em 2011, diz boletim Focus. http://is.gd/HL4e8R",Flávio Arantes,journalist,False,19817,79,39445,322,734,447,Brasil,False,[],[],0,0,0,0,pt,"<a href=""http://twitter.com"" rel=""nofollow"">Twitter Web Client</a>",,,,
826,2011-04-04 12:13:11+00:00,dinheiromaSGDA,"Mercado prevê inflação acima de 6% para este ano, revela Boletim Focus:  http://bit.ly/h7ZBrL",dinheiroSGDA,,False,296,1635,2653,0,6,6,,False,[],[],0,0,0,0,pt,"<a href=""http://twitterfeed.com"" rel=""nofollow"">twitterfeed</a>",,,,
827,2011-04-04 12:01:08+00:00,OGlobo_Economia,"Boletim Focus: Inflação pelo IPCA deve avançar 6,02% em 2011 e 5% em 2012 http://ow.ly/4swbU",O Globo_Economia,O Globo no Twitter. Acompanhe as principais notícias de economia do site do jornal O Globo,True,148690,70,32937,6,1478,14736,Brasil,False,[],[],0,0,0,0,pt,"<a href=""http://www.hootsuite.com"" rel=""nofollow"">Hootsuite</a>",,,,
828,2011-04-01 10:53:23+00:00,QueroFicarRico,Boletim Focus vai mudar divulgação de projeção de inflação http://goo.gl/CgNQ0,Rafael Seabra,"Fala, sócio! Aqui você vai descobrir como receber dividendos todos os meses (já a partir do próximo mês) pelo resto da sua vida. Comece por aqui👇",False,21197,102,6872,223,274,383,,False,[],[],0,0,0,0,pt,"<a href=""http://twitter.com"" rel=""nofollow"">Twitter Web Client</a>",,,,
829,2011-03-31 12:24:52+00:00,rlacerda_,"Banco Central muda metodologia do Boletim Fócus que apura as expectativas de mercado. Pergunta-se, o termometro estava viciado?",Ricardo Lacerda.,economista,False,1091,1337,32073,4972,25,345,,False,[],[],0,0,0,0,pt,"<a href=""http://twitter.com"" rel=""nofollow"">Twitter Web Client</a>",,,,
830,2011-03-29 01:10:42+00:00,EconomiaUFES,"Boletim Focus - 28/03 - Expectativa de Baixa no PIB e SELIC e alta na Inflação, confira: http://t.co/YGgh44c",Caleco Ufes,Espaço de divulgação do curso de Economia da Universidade Federal do Espírito Santo,False,482,403,935,76,10,66,Vitória - ES,False,"['http://www.calecoufes.com/index.php?option=com_content&view=article&id=167:boletim-focus-2803&catid=35:curtinhas&sms_ss=twitter&at_xt=4d9131604b168c4b,0']",['http://t.co/YGgh44c'],0,0,0,0,pt,"<a href=""https://dev.twitter.com/docs/tfw"" rel=""nofollow"">Twitter for Websites</a>",,,,
831,2011-03-28 21:39:40+00:00,EconomiaUFES,Mais tarde colocaremos online: Agenda Econômica Semanal; e o Boletim Focus do BACEN.,Caleco Ufes,Espaço de divulgação do curso de Economia da Universidade Federal do Espírito Santo,False,482,403,935,76,10,66,Vitória - ES,False,[],[],0,0,0,0,pt,"<a href=""https://about.twitter.com/products/tweetdeck"" rel=""nofollow"">TweetDeck</a>",,,,
832,2011-03-28 19:43:42+00:00,StoneX_Brasil,"Boletim Focus do Banco Central segue projetando pior cenário econômico para o Brasil em 2011, elevando IPCA para 6% e reduzindo PIB para 4%",StoneX Brasil,Consultoria em Futuros e Commodities. brasil.stonex.com | mercadosagricolas.com.br | dtvm.stonex.com | banco.stonex.com | asset.stonex.com,False,2186,149,15076,683,46,5049,Brasil,False,[],[],0,0,0,0,pt,"<a href=""https://about.twitter.com/products/tweetdeck"" rel=""nofollow"">TweetDeck</a>",,,,
833,2011-03-28 17:05:15+00:00,rigotto,"O Boletim Focus do Banco Central prevê uma inflação de 6% no ano enquanto a Taxa Selic chegaria a 12,50%. Veja mais   http://bit.ly/gs5EKF",Germano Rigotto,Presidente do Instituto Reformar de Estudos Políticos e Tributários;  Ex Governador do RS;  Consultor e Palestrante,False,20443,1997,52444,8564,193,739,,False,[],[],0,0,0,0,pt,"<a href=""https://about.twitter.com/products/tweetdeck"" rel=""nofollow"">TweetDeck</a>",,,,
834,2011-03-28 16:57:04+00:00,RHContabil,Mudanças do Boletim Focus afetam movimento dos DIs mais líquidos,Humberto,Escritório de Contabilidade,False,100,1790,14120,1,1,0,Brasil,False,[],[],0,0,0,0,pt,"<a href=""http://twitter.com"" rel=""nofollow"">Twitter Web Client</a>",,,,
835,2011-03-28 15:50:21+00:00,direitomoderno,Mudanças do Boletim Focus afetam movimento dos DIs mais líquidos: SÃO PAULO - As mudanças de expectativas do mer... http://glo.bo/dGmrKU,@direitomoderno,Divulgando pesquisas sobre direito nas redes sociais.Direito para todos)) Obrigado pela visita!,False,3452,915,77527,816,107,611,,False,[],[],0,0,0,0,pt,"<a href=""http://twitterfeed.com"" rel=""nofollow"">twitterfeed</a>",,,,
836,2011-03-28 15:50:20+00:00,Economyce,Mudanças do Boletim Focus afetam movimento dos DIs mais líquidos http://glo.bo/dGmrKU,Economy,A Economy Consultoria e Assessoria Empresarial apresenta soluções inovadoras para seus negócios,False,321,636,42832,0,1,1,Maringá,False,[],[],0,0,0,0,pt,"<a href=""http://twitterfeed.com"" rel=""nofollow"">twitterfeed</a>",,,,
837,2011-03-28 15:50:20+00:00,Plant_ai,Mudanças do Boletim Focus afetam movimento dos DIs mais líquidos http://glo.bo/dGmrKU #Economia,Plant.aí,"Laboratório de projetos sustentáveis integrados a tecnologia digital, marketing, entretenimento e mídias sociais.",False,2038,1700,144558,240,30,58,,False,[],[],0,0,0,0,pt,"<a href=""http://twitterfeed.com"" rel=""nofollow"">twitterfeed</a>",,,,
838,2011-03-28 15:50:19+00:00,eloipacher,Mudanças do Boletim Focus afetam movimento dos DIs mais líquidos: SÃO PAULO - As mudanças de expectativas do mer... http://glo.bo/iedYTB,eloi pacher,"Empreendedor. Autor do Curso Englishprime,com inovadora metodologia e técnica de ensino.Inglês para quem não tem tempo a perder. Curso Rápido-Prático e Fácil.",False,126,288,5652,23,1,14,Curitiba-Pr-Brasil,False,[],[],0,0,0,0,pt,"<a href=""http://twitterfeed.com"" rel=""nofollow"">twitterfeed</a>",,,,
839,2011-03-28 15:50:19+00:00,jansencosta,Mudanças do Boletim Focus afetam movimento dos DIs mais líquidos: SÃO PAULO - As mudanças de... http://glo.bo/fjsQZR invistaativa.com.br,Jansen da Costa,A arte da vida consiste em fazer da vida uma obra de arte.,False,231,127,73303,2,9,27,Rio de Janeiro,False,[],[],0,0,0,0,pt,"<a href=""http://twitterfeed.com"" rel=""nofollow"">twitterfeed</a>",,,,
840,2011-03-28 13:37:46+00:00,itaucorretora,"Boletim Focus: mercado eleva novamente projeção para o IPCA em 2011, de 5,88% para 6%",Itaú Corretora,"Análises e informações sobre o universo de investimentos!
As recomendações são realizadas pelos analistas de valores mobiliários do Itaú. #VempraItaúCorretora",True,32302,19,15982,13,568,4463,Brasil,False,[],[],0,1,0,0,pt,"<a href=""http://twitter.com"" rel=""nofollow"">Twitter Web Client</a>",,,,
841,2011-03-28 13:31:57+00:00,jfdepressaojf,"Mercado prevê inflação maior e taxa de juros menor em 2011, segundo o Boletim Focus. http://ow.ly/4nHd4",JUIZ DE FORA  DA DEPRESSÃO,"Página de HUMOR, JORNALISMO COLABORATIVO, entretenimento, ação social, diversidades e cultura no sentido plural.",False,35810,0,31858,22,166,300,Juiz de Fora - MG,False,[],[],0,0,0,0,pt,"<a href=""http://twitter.com"" rel=""nofollow"">Twitter Web Client</a>",,,,
842,2011-03-28 13:26:38+00:00,abiannda,"De acordo com o boletim Focus do Banco Central, estimativa para o IPCA aumentou de 5,88% para 6%.",A_Biannda,Especializada em implantação de produtos nos gêneros de alimentos e bebidas.,False,168,537,848,10,1,38,Curitiba - PR - Brasil,False,[],[],0,0,0,0,pt,"<a href=""https://about.twitter.com/products/tweetdeck"" rel=""nofollow"">TweetDeck</a>",,,,
843,2011-03-28 13:26:37+00:00,forumdecomunica,"De acordo com o boletim Focus do Banco Central, estimativa para o IPCA aumentou de 5,88% para 6%.",Fórum_de_Comunicação,"Fórum, Clínica e Exposição Paralela. Como rentabilizar sua empresa através da Comunicação. De 03 a 05 de outubro 11.",False,327,972,443,0,0,13,Curitiba - Paraná,False,[],[],0,0,0,0,pt,"<a href=""https://about.twitter.com/products/tweetdeck"" rel=""nofollow"">TweetDeck</a>",,,,
844,2011-03-28 13:26:36+00:00,markmesse,"De acordo com o boletim Focus do Banco Central, estimativa para o IPCA aumentou de 5,88% para 6%.",Mark Messe,"Organizadora de: Congressos Técnico Científico, Corporativo, Feiras e Projetos especiais.
Empresa com Selos de Qualidade e Turismo Responsável do MTUR.",False,183,403,1173,244,2,180,Curitiba ,False,[],[],0,0,0,0,pt,"<a href=""https://about.twitter.com/products/tweetdeck"" rel=""nofollow"">TweetDeck</a>",,,,
845,2011-03-28 13:20:02+00:00,JornalOGlobo,"Mercado prevê inflação maior e taxa de juros menor em 2011, segundo o Boletim Focus. http://ow.ly/4nHd4",Jornal O Globo,"Assine nossas newsletters: glo.bo/3zCXJkb
Instagram: bit.ly/3rcYVHq
TikTok:  tiktok.com/@jornaloglobo
Facebook: bit.ly/3dRZKmz",True,7346253,7402,498428,119,13305,218809,,False,[],[],0,2,0,0,pt,"<a href=""http://www.hootsuite.com"" rel=""nofollow"">Hootsuite</a>",,,,
846,2011-03-28 13:16:00+00:00,SistemaFIEPA,"De acordo com o boletim Focus do Banco Central a estimativa para o IPCA aumentou de 5,88% para 6%.",Sistema FIEPA,Twitter Oficial do Sistema Federação das Indústrias do Estado do Pará,False,5804,342,9977,869,32,2029,Belém - PA,False,[],[],0,0,0,0,pt,"<a href=""http://twitter.com"" rel=""nofollow"">Twitter Web Client</a>",,,,
847,2011-03-28 13:03:30+00:00,albertovianna,Boletim Focus: Mercado prevê inflação maior e taxa de juros menor em 2011 - O Globo http://t.co/8P5IwMw,Alberto Vianna,"Gosto de Psicologia, Informática, ouvir música (hip hop, rap, trap, blues, jazz, rock...)... Adoro uma boa conversa. Sou mais preto que branco.",False,166,475,4689,2881,0,36,,False,['http://oglobo.globo.com/economia/mat/2011/03/28/boletim-focus-mercado-preve-inflacao-maior-taxa-de-juros-menor-em-2011-924100858.asp'],['http://t.co/8P5IwMw'],0,0,0,0,pt,"<a href=""https://dev.twitter.com/docs/tfw"" rel=""nofollow"">Twitter for Websites</a>",,,,
848,2011-03-28 12:38:50+00:00,patrickmolas,"Expectativa para a inflação sobiu para 6%, diz boletim Focus: Ouça na CBN http://glo.bo/ggCI6M",Patrick Molas,,False,15,0,17640,0,0,0,,False,[],[],0,0,0,0,pt,"<a href=""http://twitterfeed.com"" rel=""nofollow"">twitterfeed</a>",,,,
849,2011-03-28 11:51:04+00:00,OGlobo_Economia,Boletim Focus: Mercado prevê inflação maior e taxa de juros menor em 2011 http://ow.ly/4nEeG,O Globo_Economia,O Globo no Twitter. Acompanhe as principais notícias de economia do site do jornal O Globo,True,148690,70,32937,6,1478,14736,Brasil,False,[],[],0,0,0,0,pt,"<a href=""http://www.hootsuite.com"" rel=""nofollow"">Hootsuite</a>",,,,
850,2011-03-28 11:36:51+00:00,AndreMontecchio,"Boletim #Focus rebaixa estimativas para Taxa #Selic - Por sua vez, a estimativa de crescimento do PIB http://twurl.nl/0u62tp #Ibovespa",André Montecchio,"Private Banker, CFP",False,106,412,4192,4435,3,87,,False,[],[],0,0,0,0,pt,"<a href=""http://www.snaptu.com"" rel=""nofollow"">Snaptu</a>",,,,
851,2011-03-28 11:34:40+00:00,tradebolsa,"Boletim Focus rebaixa estimativas para Taxa Selic: Por sua vez, a estimativa de crescimento do Produto Interno B... http://bit.ly/hAHH9E",Rodrigo,"Economista, formado na UFPR em 2003. Adoro operar na BMFBovespa!",False,27,15,22131,8,1,0,Curitiba - Brasil,False,[],[],0,0,0,0,pt,"<a href=""http://twitterfeed.com"" rel=""nofollow"">twitterfeed</a>",,,,
852,2011-03-28 11:34:40+00:00,RaphaelInvestor,"Boletim Focus rebaixa estimativas para Taxa Selic: Por sua vez, a estimativa de crescimento do Produto Interno B... http://bit.ly/hAHH9E",Raphael Aquino,"Investir e Incentivar a Educação Financeira de Pessoas, através de Cursos e Palestras",False,256,454,39395,13156,5,79,"Brasília, Distrito Federal",False,[],[],0,0,0,0,pt,"<a href=""http://twitterfeed.com"" rel=""nofollow"">twitterfeed</a>",,,,
853,2011-03-28 11:34:40+00:00,jansencosta,RT @uinstante Boletim Focus rebaixa estimativas para Taxa Selic http://bit.ly/g6up2D #noticias,Jansen da Costa,A arte da vida consiste em fazer da vida uma obra de arte.,False,231,127,73303,2,9,27,Rio de Janeiro,False,[],[],0,0,0,0,pt,"<a href=""http://twitterfeed.com"" rel=""nofollow"">twitterfeed</a>",,,,"[User(username='uinstante', id=73415003, displayname='ultimoInstante', rawDescription=None, renderedDescription=None, descriptionLinks=None, verified=None, created=None, followersCount=None, friendsCount=None, statusesCount=None, favouritesCount=None, listedCount=None, mediaCount=None, location=None, protected=None, link=None, profileImageUrl=None, profileBannerUrl=None, label=None)]"
854,2011-03-25 22:52:32+00:00,RobsonRobe,"Gente, tenho q descobrir o que é Boletim Focus... eu não faço idéia!",Ultimate.Bob,Delusion by Bob,False,67,336,5595,12990,0,58,,False,[],[],0,0,0,0,pt,"<a href=""http://twitter.com"" rel=""nofollow"">Twitter Web Client</a>",,,,
855,2011-03-24 13:35:43+00:00,facesp,"No Boletim Focus, do BC, divulgado dia 21/03, os economistas subiram a previsão para o IPCA de 2011 de 5,82% para 5,88%.",FACESP,Federação das Associações Comerciais do Estado de São Paulo,False,947,120,8169,1071,11,2002,"São Paulo, Brasil",False,[],[],0,0,0,0,pt,"<a href=""http://twitter.com"" rel=""nofollow"">Twitter Web Client</a>",,,,
856,2011-03-21 15:13:35+00:00,canal_direto,"O Boletim #Focus do BC elevou de 5,82% para 5,88% a estimativa para a inflação oficial neste ano.",Canal Direto,Canal direto de notícias que possam ser relevantes no Mercado Financeiro.,False,4,33,153,0,0,0,Brasília-DF,False,[],[],0,0,0,0,pt,"<a href=""http://twitter.com"" rel=""nofollow"">Twitter Web Client</a>",,,,
857,2011-03-21 14:32:45+00:00,riskoffice,"Boletim Focus traz estimativa de alta de 5,88% para IPCA em 2011 http://goo.gl/MfXeK",RiskOffice,,False,35,0,174,0,2,3,,False,[],[],0,0,0,0,pt,"<a href=""http://twitter.com"" rel=""nofollow"">Twitter Web Client</a>",,,,
858,2011-03-21 14:24:52+00:00,EconomiaUFES,"Mais detalhes e o relatório completo do Boletim Focus do BACEN, em breve em www.calecoufes.com",Caleco Ufes,Espaço de divulgação do curso de Economia da Universidade Federal do Espírito Santo,False,482,403,935,76,10,66,Vitória - ES,False,[],[],0,0,0,0,pt,"<a href=""https://about.twitter.com/products/tweetdeck"" rel=""nofollow"">TweetDeck</a>",,,,
859,2011-03-21 14:24:35+00:00,EconomiaUFES,"Boletim Focus: previsão do IPCA sobe de 5,82% para 5,88%; previsão do PIB recua de 4,10% para 4,03%; previsão da SELIC mantém 12,50%",Caleco Ufes,Espaço de divulgação do curso de Economia da Universidade Federal do Espírito Santo,False,482,403,935,76,10,66,Vitória - ES,False,[],[],0,0,0,0,pt,"<a href=""https://about.twitter.com/products/tweetdeck"" rel=""nofollow"">TweetDeck</a>",,,,
860,2011-03-21 13:45:09+00:00,therezafontoura,"@eikebatista Segundo o Boletim Focus,o mercado financeiro reduziu a projeção de crescimento do PIB em 2011, de 4,10% para 4,03%",Thereza Fontoura,"Economista , botafoguense , carioca",False,367,194,932817,374333,0,137598,,False,[],[],0,0,0,0,pt,"<a href=""http://twitter.com"" rel=""nofollow"">Twitter Web Client</a>",,,,"[User(username='eikebatista', id=119064111, displayname='Eike Batista Oficial', rawDescription=None, renderedDescription=None, descriptionLinks=None, verified=None, created=None, followersCount=None, friendsCount=None, statusesCount=None, favouritesCount=None, listedCount=None, mediaCount=None, location=None, protected=None, link=None, profileImageUrl=None, profileBannerUrl=None, label=None)]"
861,2011-03-21 13:05:30+00:00,goBBLOG,"Boletim Focus traz estimativa de alta de 5,88% para IPCA em 2011 | Valor Online http://j.mp/fA0Ih7 via @AddToAny",BBLOG BB e Entidades,"BBLOG·Funcionários do Banco do Brasil e Entidades. Sistema bancário, sindicalismo, microcrédito, cooperativismo, BB e entidades dos funcionários",False,300,570,10539,2,4,7,"Curitiba, Brasil",False,[],[],0,0,0,0,pt,"<a href=""http://twitter.com"" rel=""nofollow"">Twitter Web Client</a>",,,,"[User(username='AddToAny', id=21849140, displayname='AddToAny', rawDescription=None, renderedDescription=None, descriptionLinks=None, verified=None, created=None, followersCount=None, friendsCount=None, statusesCount=None, favouritesCount=None, listedCount=None, mediaCount=None, location=None, protected=None, link=None, profileImageUrl=None, profileBannerUrl=None, label=None)]"
862,2011-03-21 12:58:08+00:00,GlauberTeixeira,"Aula de Microeconomia2 com #CelsoBissoli. E no mercado, boletim Focus prevê mais uma alta na SELIC",Glauber Teixeira,"Flamenguista, formado em Sistemas de Informação, pós-graduado em Gestão Pública e Contábil e MTG player nas horas vagas!",False,866,87,15955,2353,20,397,"Vitória, Espírito Santo",False,[],[],0,0,0,0,pt,"<a href=""http://mobile.twitter.com"" rel=""nofollow"">Mobile Web</a>",,,,
863,2011-03-21 12:37:05+00:00,slwcorretora,"Indicadores: Boletim Focus traz estimativa de alta de 5,88% para IPCA em 2011",SLW Corretora,"Mercado financeiro com tradição, agilidade e transparência há 40 anos.",False,907,0,13548,0,57,0,"São Paulo, Brasil",False,[],[],0,0,0,0,pt,"<a href=""http://twitter.com"" rel=""nofollow"">Twitter Web Client</a>",,,,
864,2011-03-21 12:24:57+00:00,fernandoarbache,"Boletim Focus do BC, com previsões de 100 instituições financeiras, elevou de 5,82% para 5,88% a estimativa para a inflação oficial em 2011",Fernando Arbache,"Fernando Arbache é palestrante, autor e consultor, com uma ampla e respeitada jornada. Siga-nos e receba insights de altíssimo nível.",False,590,938,19189,43,16,421,São Paulo,False,[],[],0,0,0,0,pt,"<a href=""http://itunes.apple.com/us/app/twitter/id409789998?mt=12"" rel=""nofollow"">Twitter for Mac</a>",,,,
865,2011-03-21 12:17:17+00:00,direitomoderno,"Boletim Focus traz estimativa de alta de 5,88% para IPCA em 2011: SÃO PAULO - A previsão para a inflação oficial... http://glo.bo/dQQiT8",@direitomoderno,Divulgando pesquisas sobre direito nas redes sociais.Direito para todos)) Obrigado pela visita!,False,3452,915,77527,816,107,611,,False,[],[],0,0,0,0,pt,"<a href=""http://twitterfeed.com"" rel=""nofollow"">twitterfeed</a>",,,,
866,2011-03-21 12:17:16+00:00,Economyce,"Boletim Focus traz estimativa de alta de 5,88% para IPCA em 2011 http://glo.bo/dQQiT8",Economy,A Economy Consultoria e Assessoria Empresarial apresenta soluções inovadoras para seus negócios,False,321,636,42832,0,1,1,Maringá,False,[],[],0,0,0,0,pt,"<a href=""http://twitterfeed.com"" rel=""nofollow"">twitterfeed</a>",,,,
867,2011-03-21 12:17:16+00:00,Plant_ai,"Boletim Focus traz estimativa de alta de 5,88% para IPCA em 2011 http://glo.bo/dQQiT8 #Economia",Plant.aí,"Laboratório de projetos sustentáveis integrados a tecnologia digital, marketing, entretenimento e mídias sociais.",False,2038,1700,144558,240,30,58,,False,[],[],0,0,0,0,pt,"<a href=""http://twitterfeed.com"" rel=""nofollow"">twitterfeed</a>",,,,
868,2011-03-21 12:11:43+00:00,RHContabil,"Boletim Focus traz estimativa de alta de 5,88% para IPCA em 2011",Humberto,Escritório de Contabilidade,False,100,1790,14120,1,1,0,Brasil,False,[],[],0,0,0,0,pt,"<a href=""http://twitter.com"" rel=""nofollow"">Twitter Web Client</a>",,,,
869,2011-03-21 12:02:12+00:00,jrdarospy,"Boletim Focus traz estimativa de alta de 5,88% para IPCA em 2011 http://dlvr.it/KztGY",Junior Daros,,False,130,227,283015,0,9,261,"Mallorquin, Py",False,[],[],0,0,0,0,pt,"<a href=""https://dlvrit.com/"" rel=""nofollow"">dlvr.it</a>",,,,
870,2011-03-21 12:01:10+00:00,investwitt,"@UOL Boletim Focus traz estimativa de alta de 5,88% para IPCA em 2011 http://clig.at/14r investwitt.com",Invest Twitt,,False,160,1,64080,0,9,1,,False,[],[],0,0,0,0,pt,"<a href=""http://twitterfeed.com"" rel=""nofollow"">twitterfeed</a>",,,,"[User(username='UOL', id=70799317, displayname='UOL', rawDescription=None, renderedDescription=None, descriptionLinks=None, verified=None, created=None, followersCount=None, friendsCount=None, statusesCount=None, favouritesCount=None, listedCount=None, mediaCount=None, location=None, protected=None, link=None, profileImageUrl=None, profileBannerUrl=None, label=None)]"
871,2011-03-21 12:01:09+00:00,vmoretoconsult,"Boletim Focus traz estimativa de alta de 5,88% para IPCA em 2011:  http://tinyurl.com/4fmdsag #VMConsulting",VM Consulting,Consultoria Econômico-Financeira especializada em Agronegócio.,False,30,2,45943,0,2,0,Ribeirão Preto - SP,False,[],[],0,0,0,0,pt,"<a href=""http://twitterfeed.com"" rel=""nofollow"">twitterfeed</a>",,,,
872,2011-03-21 12:01:04+00:00,mundonoticiasss,"Boletim Focus traz estimativa de alta de 5,88% para IPCA em 2011:  http://bit.ly/g3ktLo",Marcio Teodoro,Por um Brasil mais justo!,False,2581,821,3078781,12,328,492,MG - Brasil,False,[],[],0,0,0,0,pt,"<a href=""http://twitterfeed.com"" rel=""nofollow"">twitterfeed</a>",,,,
873,2011-03-21 12:01:04+00:00,livejornal,"Boletim Focus traz estimativa de alta de 5,88% para IPCA em 2011:  http://bit.ly/g3ktLo",LiveJornal,Fique Informado em tudo o que acontece no Brasil e no Mundo em poucos segundos. Siga e seja Seguido! Adeptos da Lei da Reciprococidade Follow @JacksonFers,False,2156,2633,924561,2,71,0,,False,[],[],0,0,0,0,pt,"<a href=""http://twitterfeed.com"" rel=""nofollow"">twitterfeed</a>",,,,
874,2011-03-21 12:01:03+00:00,mundonoticiasss,"Boletim Focus traz estimativa de alta de 5,88% para IPCA em 2011:  http://bit.ly/h04hp3",Marcio Teodoro,Por um Brasil mais justo!,False,2581,821,3078781,12,328,492,MG - Brasil,False,[],[],0,0,0,0,pt,"<a href=""http://twitterfeed.com"" rel=""nofollow"">twitterfeed</a>",,,,
875,2011-03-21 12:01:03+00:00,NdoEmpreendedor,"Boletim Focus traz estimativa de alta de 5,88% para IPCA em 2011 http://bit.ly/dJzwxp",Noitedo Empreendedor,"Noite do Empreendedor
Palestras, cursos e treinamentos em Belém. 
Buscamos estimular o desenvolvimento realizando eventos empreendedores de alta qualidade.",False,1133,962,47377,2,17,0,Belém,False,[],[],0,0,0,0,pt,"<a href=""http://twitterfeed.com"" rel=""nofollow"">twitterfeed</a>",,,,
876,2011-03-21 12:01:03+00:00,AllNoticias,"Boletim Focus traz estimativa de alta de 5,88% para IPCA em 2011:  http://bit.ly/g3ktLo",All Notícias,As notícias dos maiores sites do Brasil estão reunidas aqui.,False,292,18,193310,0,19,0,Brasil,False,[],[],0,0,0,0,pt,"<a href=""http://twitterfeed.com"" rel=""nofollow"">twitterfeed</a>",,,,
877,2011-03-21 11:37:01+00:00,OGlobo_Economia,"Boletim Focus: Mercado eleva novamente cenário para a inflação em 2011, aponta BC http://ow.ly/4iyAN",O Globo_Economia,O Globo no Twitter. Acompanhe as principais notícias de economia do site do jornal O Globo,True,148690,70,32937,6,1478,14736,Brasil,False,[],[],0,1,0,0,pt,"<a href=""http://www.hootsuite.com"" rel=""nofollow"">Hootsuite</a>",,,,
878,2011-03-21 11:03:32+00:00,GlauberTeixeira,Hoje tem divulgação do Boletim Focus pelo BACEN.,Glauber Teixeira,"Flamenguista, formado em Sistemas de Informação, pós-graduado em Gestão Pública e Contábil e MTG player nas horas vagas!",False,866,87,15955,2353,20,397,"Vitória, Espírito Santo",False,[],[],0,0,0,0,pt,"<a href=""http://mobile.twitter.com"" rel=""nofollow"">Mobile Web</a>",,,,
879,2011-03-15 13:02:45+00:00,JovemPanNews,"Vendas do comércio desafiam política do BC: O boletim Focus, as vendas do comércio e os juros de... http://bit.ly/ed1uWo #portaljovempan",Jovem Pan News,"Portal do Grupo Jovem Pan 
Facebook: facebook.com/jovempannews
Instagram: @jovempannews 
Telegram: t.me/oficialjpnews",True,1945646,2072,437847,3232,2453,134060,Brasil,False,[],[],0,0,0,0,pt,"<a href=""http://twitterfeed.com"" rel=""nofollow"">twitterfeed</a>",,,,
880,2011-03-15 09:22:56+00:00,vitorwilherbr,#blog: O Boletim Focus do Banco Central http://bit.ly/edC2yI,Vítor Wilher,Sócio-Fundador e Cientista de Dados na Análise Macro (analisemacro.com.br). Meu portfólio pode ser acessado em vitorwilher.github.io.,False,1005,127,3268,201,23,88,"Rio de Janeiro, Brasil",False,[],[],0,0,0,0,pt,"<a href=""http://vitorwilher.com"" rel=""nofollow"">blog vitorwilher</a>",,,,
