,datetime,username,content,display name,user description,verified,follower count,friends count,statuses count,favourites count,listed count,media count,location,protected,outlinks,tcooutlinks,reply count,retweet count,like count,quote count,lang,source,media,retweeted tweet,quoted tweet,mentioned users
527,2011-06-13 19:02:28+00:00,cdlrecife,Boletim Focus confirma inflação mais amena e sugere fim da alta da Selic em julho. http://ow.ly/5gIDk,CDL Recife,"A Câmara de Dirigentes Lojistas do Recife é uma entidade ligada ao movimento cedelista que luta em prol do desenvolvimento do comércio, da economia e da cidade.",False,1914,968,13569,12,19,307,Recife - PE,False,[],[],0,0,0,0,pt,"<a href=""http://www.hootsuite.com"" rel=""nofollow"">Hootsuite</a>",,,,
528,2011-06-13 18:43:53+00:00,agenciagraffo,"13/6: Boletim Focus - IPCA.
Gráfico: GRec29652. Tamanho: 1 x 9cm",Agência Graffo,"A Graffo é uma agência que produz e distribui notícias em forma de infográficos. Para saber mais, acesse nosso site.",False,24,0,16764,0,1,0,Brasil,False,[],[],0,0,0,0,pt,"<a href=""http://twitter.com"" rel=""nofollow"">Twitter Web Client</a>",,,,
529,2011-06-13 15:53:11+00:00,valle_xavier,"Projeções no Boletim Focus ainda estimam inflação de 5,13% para 2012. Ainda está acima do centro da meta prometido pelo governo.",Matheus Xavier,,False,8,22,67,1,0,0,Cabo Frio - RJ (Brasil),False,[],[],0,0,0,0,pt,"<a href=""http://twitter.com"" rel=""nofollow"">Twitter Web Client</a>",,,,
530,2011-06-13 14:50:25+00:00,InvestMais,"#Focus. Inflação no País tem queda novamente, de acordo com boletim do Banco Central: http://bit.ly/mRqEWk",Revista InvestMais,A revista do investidor na bolsa.,False,4692,134,3786,2,204,5,Brazil,False,[],[],0,0,0,0,pt,"<a href=""http://www.hootsuite.com"" rel=""nofollow"">Hootsuite</a>",,,,
531,2011-06-13 13:02:31+00:00,DailyBusinessBR,"[#Economia] » Mercado reduz para 6,19% previsão de inflação em 2011: Boletim Focus mostrou recuo em r... http://bit.ly/k2evkb #WhataNews",Daily Business BR,Whataheal Daily Business - #ECONOMIA | geekstech.com.br | Sua fonte inesgotável de informação sobre ECONOMIA e FINANÇAS.,False,156,193,33137,2,3,0,"São Paulo, SP",False,[],[],0,0,0,0,pt,"<a href=""http://twitterfeed.com"" rel=""nofollow"">twitterfeed</a>",,,,
532,2011-06-13 13:02:31+00:00,DailyBusinessBR,"[#Economia] » Mercado reduz para 6,19% previsão de inflação em 2011: Boletim Focus mostrou recuo em r... http://bit.ly/k2evkb #WhataNews",Daily Business BR,Whataheal Daily Business - #ECONOMIA | geekstech.com.br | Sua fonte inesgotável de informação sobre ECONOMIA e FINANÇAS.,False,156,193,33137,2,3,0,"São Paulo, SP",False,[],[],0,0,0,0,pt,"<a href=""http://twitterfeed.com"" rel=""nofollow"">twitterfeed</a>",,,,
533,2011-06-13 13:02:31+00:00,iramilso,"Mercado reduz para 6,19% previsão de inflação em 2011: Boletim Focus mostrou recuo em relação às estimativas anteriores http://bit.ly/l0JB7x",Iramilso Santos,Militar do Exército. Sou graduado em História pela UFG.,False,119,61,310605,61,0,3,"Goiânia, Brasil",False,[],[],0,0,0,0,pt,"<a href=""http://twitterfeed.com"" rel=""nofollow"">twitterfeed</a>",,,,
534,2011-06-13 12:55:00+00:00,facesp,"Projeção para o IPCA recuou de 6,22% para 6,19%; já a projeção do PIB caiu de 4,00% para 3,96%, segundo o Boletim Focus.",FACESP,Federação das Associações Comerciais do Estado de São Paulo,False,947,120,8169,1071,11,2002,"São Paulo, Brasil",False,[],[],0,1,0,0,pt,"<a href=""http://twitter.com"" rel=""nofollow"">Twitter Web Client</a>",,,,
535,2011-06-13 12:26:16+00:00,rigotto,"Boletim Focus prevê inflação de 6,19% no ano. Para o PIB a previsão é de um crescimento de 3,96% em 2011 e o câmbio fecharia o ano à R$ 1,60",Germano Rigotto,Presidente do Instituto Reformar de Estudos Políticos e Tributários;  Ex Governador do RS;  Consultor e Palestrante,False,20443,1997,52444,8564,193,739,,False,[],[],0,0,0,0,pt,"<a href=""https://about.twitter.com/products/tweetdeck"" rel=""nofollow"">TweetDeck</a>",,,,
536,2011-06-13 12:19:11+00:00,ThiagoVGalvao,"Boletim Focus: IPCA para 2011 recua de 6,22% para 6,19% e projeção para 2012 sobe de 5,1% para 5,13%.",Thiago Galvão,"Private Banking, Investidor, Administrador, Pós-graduado em Economia. Opniões Pessoais.",False,554,47,9203,7116,5,104,,False,[],[],0,0,0,0,pt,"<a href=""http://twitter.com/download/iphone"" rel=""nofollow"">Twitter for iPhone</a>",,,,
537,2011-06-13 12:18:09+00:00,duschumacher,"boa semana e bons negócios!! Boletim Focus: IPCA para 2011 recua de 6,22% para 6,19% e projeção para 2012 sobe de 5,1% para 5,13%.”",Eduardo Schumacher,"Advogado, faixa preta…protagonista! Conselheiro do Grêmio Foot-ball Porto Alegrense. 🌿",False,587,809,12732,3932,5,874,"Porto Alegre, Brasil",False,[],[],0,0,0,0,pt,"<a href=""http://twitter.com/#!/download/ipad"" rel=""nofollow"">Twitter for iPad</a>",,,,
538,2011-06-13 11:51:59+00:00,cdlrecife,"Bom dia! Mercado baixa para 6,19% expectativa de inflação para 2011. Esta é a sexta queda consecutiva da previsão do boletim Focus, do BC.",CDL Recife,"A Câmara de Dirigentes Lojistas do Recife é uma entidade ligada ao movimento cedelista que luta em prol do desenvolvimento do comércio, da economia e da cidade.",False,1914,968,13569,12,19,307,Recife - PE,False,[],[],0,0,0,0,pt,"<a href=""http://twitter.com"" rel=""nofollow"">Twitter Web Client</a>",,,,
539,2011-06-13 11:46:48+00:00,fbeys80,"Boletim Focus indica novamente queda da projeção do IPCA para 2011. Cainde de 6,22% para 6,19%.",Felipe Beys,Customer Relationship Manager na Warren Brasil. Mestre em Administracao de Empresas. Economista UFRGS. Apaixonado por futebol.,False,89,422,506,38,1,2,,False,[],[],0,0,0,0,pt,"<a href=""http://twitter.com"" rel=""nofollow"">Twitter Web Client</a>",,,,
540,2011-06-08 23:31:16+00:00,_GAPEC,SELIC agora é de 12.25% Boletim Focus já sabia!,GAPEC,"Grupo de Análise Política e Econômica Capixaba - Visite-nos: gapec.com.br, o Maior Acervo Político Econômico Capixaba!",False,147,174,846,9,3,3,Espírito Santo,False,[],[],0,0,0,0,pt,"<a href=""https://about.twitter.com/products/tweetdeck"" rel=""nofollow"">TweetDeck</a>",,,,
541,2011-06-07 18:27:22+00:00,imobLosso,"O mercado financeiro reduziu 6,22% a projeção p/ inflação em 2011, segundo o boletim Focus: http://bit.ly/lBw3wM",Imobiliária Losso,"Desde 1971

Compra, venda, locação, administração e consultoria de imóveis em Curitiba, PR.

+55 41   3204 3333
+55 41 99762 2448

Creci 1770J",False,1291,102,1790,45,6,336,"Curitiba, Brasil",False,[],[],0,0,0,0,pt,"<a href=""https://about.twitter.com/products/tweetdeck"" rel=""nofollow"">TweetDeck</a>",,,,
542,2011-06-06 21:00:53+00:00,agenciagraffo,"6/6: Boletim Focus. 
Gráfico: GRec29562. Tamanho: 2 x 9cm",Agência Graffo,"A Graffo é uma agência que produz e distribui notícias em forma de infográficos. Para saber mais, acesse nosso site.",False,24,0,16764,0,1,0,Brasil,False,[],[],0,0,0,0,pt,"<a href=""http://twitter.com"" rel=""nofollow"">Twitter Web Client</a>",,,,
543,2011-06-06 18:17:28+00:00,UchoInfo,"Governo continua gastando, inflação tem recuo pífio e Copom deve elevar  http://bit.ly/kWCB2n #banco_central #boletim_focus #copom @uchoinfo",Ucho.info,"Há 20 anos produzindo jornalismo de qualidade e independente! UCHO.INFO - ""A Marca da Notícia""",False,2536,1252,37680,33,111,7253,Brasil,False,[],[],0,0,0,0,pt,"<a href=""http://ucho.info"" rel=""nofollow"">wp twitteer</a>",,,,"[User(username='UchoInfo', id=39525281, displayname='Ucho.info', rawDescription=None, renderedDescription=None, descriptionLinks=None, verified=None, created=None, followersCount=None, friendsCount=None, statusesCount=None, favouritesCount=None, listedCount=None, mediaCount=None, location=None, protected=None, link=None, profileImageUrl=None, profileBannerUrl=None, label=None)]"
544,2011-06-06 17:48:14+00:00,ARISTIDESLOBAO,"No Boletim Focus dessa semana mercado financeiro reduz previsão para IPCA de 2011 para 6,22%...",ARISTIDES LOBÃO NETO,ECONOMISTA - CONSULTOR GERAL LEGISLATIVO - ETERNAMENTE FLAMENGO E MOTO,False,855,469,17509,57,16,280,SÃO LUÍS-MA,False,[],[],0,0,0,0,pt,"<a href=""http://twitter.com"" rel=""nofollow"">Twitter Web Client</a>",,,,
545,2011-06-06 17:28:37+00:00,AFXGILINVEST,"De acordo com o boletim Focus, o Índice de Preços ao Consumidor Amplo  foi estimado em 6,22% ao final do ano, redução de 0,01 p.p. na semana",Ivan Gil MSF,"Perfil Profissional 
 Analista Financeiro e Trader. Nada é mais difícil e por isso mais precioso, do que ser capaz de decidir",False,307,180,2935,3,8,7,Brazil,False,[],[],0,0,0,0,pt,"<a href=""http://twitter.com"" rel=""nofollow"">Twitter Web Client</a>",,,,
546,2011-06-06 15:57:12+00:00,RitaMundim,"O Boletim Focus desta semana trouxe nova redução nas perspectivas da inflação de 2011. A previsão do IPCA passou de 6,23% para 6,22% a.a..",Rita Mundim,Economista e Comentarista Econômica da Rádio ITATIAIA,False,8663,501,20931,1271,62,1116,Belo Horizonte - MG,False,[],[],0,0,0,0,pt,"<a href=""http://twitter.com"" rel=""nofollow"">Twitter Web Client</a>",,,,
547,2011-06-06 14:04:07+00:00,StoneX_Brasil,"Pela quinta semana consecutiva, mercado reduz previsão de inflação para 2011. Segundo o Boletim Focus, IPCA deve avançar 6,22% no ano.",StoneX Brasil,Consultoria em Futuros e Commodities. brasil.stonex.com | mercadosagricolas.com.br | dtvm.stonex.com | banco.stonex.com | asset.stonex.com,False,2186,149,15076,683,46,5049,Brasil,False,[],[],0,0,0,0,pt,"<a href=""http://twitter.com"" rel=""nofollow"">Twitter Web Client</a>",,,,
548,2011-06-06 13:46:04+00:00,fcdlrs,"Mercado reduz projeções para índices de inflação em 2011, de acordo com boletim Focus desta segunda. http://bit.ly/lyfZpF",FCDL-RS,"Twitter da Federação das Câmaras de Dirigentes Lojistas do Rio Grande do Sul, entidade que representa e congrega a Classe Lojista no Estado.",False,1480,466,7458,178,10,939,Porto Alegre - RS,False,[],[],0,0,0,0,pt,"<a href=""http://twitter.com"" rel=""nofollow"">Twitter Web Client</a>",,,,
549,2011-06-06 13:31:06+00:00,seguirVitor,"Boletim Focus do Banco Central mostra redução nas projeções de inflação em 2011. IPCA passou de 6,23% para 6,22% e IGP-M, de 6,9% para 6,7%.",Vitor Carvalho,Riso solto e alma leve.,False,743,100,2259,13,3,46,Brasil,False,[],[],0,0,0,0,pt,"<a href=""http://twitter.com"" rel=""nofollow"">Twitter Web Client</a>",,,,
550,2011-06-06 13:30:12+00:00,ThiagoVGalvao,"Boletim Focus do Banco Central mostra redução nas projeções de inflação em 2011. IPCA passou de 6,23% para 6,22% e IGP-M, de 6,9% para 6,7%.",Thiago Galvão,"Private Banking, Investidor, Administrador, Pós-graduado em Economia. Opniões Pessoais.",False,554,47,9203,7116,5,104,,False,[],[],0,0,0,0,pt,"<a href=""http://twitter.com/download/iphone"" rel=""nofollow"">Twitter for iPhone</a>",,,,
551,2011-06-06 12:53:14+00:00,itaucorretora,"Boletim Focus do Banco Central mostra redução nas projeções de inflação em 2011. IPCA passou de 6,23% para 6,22% e IGP-M, de 6,9% para 6,7%.",Itaú Corretora,"Análises e informações sobre o universo de investimentos!
As recomendações são realizadas pelos analistas de valores mobiliários do Itaú. #VempraItaúCorretora",True,32302,19,15982,13,568,4463,Brasil,False,[],[],0,0,0,0,pt,"<a href=""http://twitter.com"" rel=""nofollow"">Twitter Web Client</a>",,,,
552,2011-06-06 11:39:33+00:00,DailyBusinessBR,"[#Economia] » Na semana do Copom, analistas reduzem expectativa de inflação: Boletim Focus aponta pro... http://bit.ly/mlmLVY #WhataNews",Daily Business BR,Whataheal Daily Business - #ECONOMIA | geekstech.com.br | Sua fonte inesgotável de informação sobre ECONOMIA e FINANÇAS.,False,156,193,33137,2,3,0,"São Paulo, SP",False,[],[],0,0,0,0,pt,"<a href=""http://twitterfeed.com"" rel=""nofollow"">twitterfeed</a>",,,,
553,2011-06-06 11:39:33+00:00,DailyBusinessBR,"[#Economia] » Na semana do Copom, analistas reduzem expectativa de inflação: Boletim Focus aponta pro... http://bit.ly/mlmLVY #WhataNews",Daily Business BR,Whataheal Daily Business - #ECONOMIA | geekstech.com.br | Sua fonte inesgotável de informação sobre ECONOMIA e FINANÇAS.,False,156,193,33137,2,3,0,"São Paulo, SP",False,[],[],0,0,0,0,pt,"<a href=""http://twitterfeed.com"" rel=""nofollow"">twitterfeed</a>",,,,
554,2011-06-06 11:39:33+00:00,iramilso,"Na semana do Copom, analistas reduzem expectativa de inflação: Boletim Focus aponta projeção de 6,22% para o IPC... http://bit.ly/jFcxST",Iramilso Santos,Militar do Exército. Sou graduado em História pela UFG.,False,119,61,310605,61,0,3,"Goiânia, Brasil",False,[],[],0,0,0,0,pt,"<a href=""http://twitterfeed.com"" rel=""nofollow"">twitterfeed</a>",,,,
555,2011-05-31 14:39:51+00:00,facesp,"....no acúmulo de 12 meses até fev/2011, segundo o boletim Focus do BC.",FACESP,Federação das Associações Comerciais do Estado de São Paulo,False,947,120,8169,1071,11,2002,"São Paulo, Brasil",False,[],[],0,0,0,0,pt,"<a href=""http://twitter.com"" rel=""nofollow"">Twitter Web Client</a>",,,,
556,2011-05-30 19:24:11+00:00,EleticiaeDio,"Leiam. JBS lidera ganhos; CSN cai com terceiro dia de greve - Na agenda do dia, o boletim Focus trouxe um novo alívi... http://ow.ly/1cXdKt",Eletícia,,False,321,798,16161,0,4,0,,False,[],[],0,0,0,0,pt,"<a href=""http://www.hootsuite.com"" rel=""nofollow"">Hootsuite</a>",,,,
557,2011-05-30 18:26:45+00:00,JornalAverdadeE,"JBS lidera ganhos; CSN cai com terceiro dia de greve: Na agenda do dia, o boletim Focus trouxe um novo alívio na... http://bit.ly/jI3qVG",AverdadeÉ,,False,17,10,48394,0,0,1,"Ibitinga - São Paulo, Brasil",False,[],[],0,0,0,0,pt,"<a href=""http://twitterfeed.com"" rel=""nofollow"">twitterfeed</a>",,,,
558,2011-05-30 18:26:45+00:00,iramilso,"JBS lidera ganhos; CSN cai com terceiro dia de greve: Na agenda do dia, o boletim Focus trouxe um novo alívio na... http://bit.ly/jI3qVG",Iramilso Santos,Militar do Exército. Sou graduado em História pela UFG.,False,119,61,310605,61,0,3,"Goiânia, Brasil",False,[],[],0,0,0,0,pt,"<a href=""http://twitterfeed.com"" rel=""nofollow"">twitterfeed</a>",,,,
559,2011-05-30 18:00:11+00:00,conjunturaufop,Boletim Focus: http://tinyurl.com/3hz43lc,Conjuntura - UFOP,Perfil do Grupo de Pesquisa em Conjuntura Econômica da UFOP.,False,13,0,12,0,0,0,,False,[],[],0,0,0,0,pt,"<a href=""http://twitter.com"" rel=""nofollow"">Twitter Web Client</a>",,,,
560,2011-05-30 17:36:31+00:00,rigotto,"Boletim Focus prevê inflação de 6,23% em 2011. PIB do país crescerá 4% no ano. Veja mais na minha News.  http:// bit.ly/GR3005",Germano Rigotto,Presidente do Instituto Reformar de Estudos Políticos e Tributários;  Ex Governador do RS;  Consultor e Palestrante,False,20443,1997,52444,8564,193,739,,False,[],[],0,0,0,0,pt,"<a href=""https://about.twitter.com/products/tweetdeck"" rel=""nofollow"">TweetDeck</a>",,,,
561,2011-05-30 17:03:23+00:00,RitaMundim,"O boletim Focus trouxe nova queda nas previsões de inflação para 2011, que passaram de 6,27% para 6,23%.",Rita Mundim,Economista e Comentarista Econômica da Rádio ITATIAIA,False,8663,501,20931,1271,62,1116,Belo Horizonte - MG,False,[],[],0,0,0,0,pt,"<a href=""http://twitter.com"" rel=""nofollow"">Twitter Web Client</a>",,,,
562,2011-05-30 16:37:52+00:00,seguroseriscos,""" O relatório semanal produzido pelo Banco Central (BC) divulgado nesta manhã, o boletim Focus, centrou as ate... http://bit.ly/m5Pk4Y """,Seguros e Riscos,"Seguros e Riscos. O Mercado Segurador e Previdenciário: suas notícias, profissionais, empresas e serviços.",False,331,36,77004,0,7,1,"Curitiba, Brasil",False,[],[],0,0,0,0,pt,"<a href=""http://twitterfeed.com"" rel=""nofollow"">twitterfeed</a>",,,,
563,2011-05-30 16:23:04+00:00,AldoNunes57,Boletim Focus volta a reduzir previsão de inflação para 2011 — Rede Brasil Atual - http://goo.gl/SsWc0 @MiriamLeitaoCom vai se suicidar.,Aldo Nunes (Lobo da Caatinga)1️⃣3️⃣ 🚩🚩,Santista roxo,False,8733,6015,648395,39155,87,6966,Teixeira - PB - Brasil,False,[],[],0,0,0,0,pt,"<a href=""https://www.shareaholic.com"" rel=""nofollow"">Shareaholic.com</a>",,,,
564,2011-05-30 16:09:11+00:00,redebrasilatual,Boletim Focus volta a reduzir previsão de inflação para 2011:  http://bit.ly/lPYrNV,Rede Brasil Atual,O olhar do trabalhador sobre os fatos do Brasil e do mundo. #RBA,False,85712,1263,77247,2065,794,13275,Brasil,False,[],[],0,1,0,0,pt,"<a href=""http://twitterfeed.com"" rel=""nofollow"">twitterfeed</a>",,,,
565,2011-05-30 13:39:00+00:00,marcionas,"Previsão para a inflação brasileira (IPCA) cai pela 4ª semana e está em 6,23% para 2011, conforme Boletim Focus.",Márcio Nascimento,"Algumas paixões: esporte, economia, música, marketing, livros, turismo. Tá bom, né?",False,6196,6596,3234,9600,14,1810,Brasília/DF,False,[],[],0,0,0,0,pt,"<a href=""http://twitter.com"" rel=""nofollow"">Twitter Web Client</a>",,,,
566,2011-05-30 13:00:46+00:00,AFXGILINVEST,"A inflação oficial, medida pelo IPCA, deve ficar em 6,23% em 2011, conforme o Boletim Focus, divulgado
nesta segunda-feira.",Ivan Gil MSF,"Perfil Profissional 
 Analista Financeiro e Trader. Nada é mais difícil e por isso mais precioso, do que ser capaz de decidir",False,307,180,2935,3,8,7,Brazil,False,[],[],0,0,0,0,pt,"<a href=""http://twitter.com"" rel=""nofollow"">Twitter Web Client</a>",,,,
567,2011-05-30 12:45:18+00:00,ricismael,"Boletim Focus,divulgado pelo Banco Central,aponta pequena desaceleração inflação.Mas ela ainda supera 6% em 2011.   http://bit.ly/lEfrIa",Ricardo Ismael,"Cientista Político PUC-Rio, Coordenador Laboratório Pesquisa Governo, Desenvolvimento e Equidade e Observador Conjuntura Política",False,328,54,5473,1,6,48,Rio de Janeiro,False,[],[],0,0,0,0,pt,"<a href=""http://twitter.com"" rel=""nofollow"">Twitter Web Client</a>",,,,
568,2011-05-30 12:33:06+00:00,CimpexCorretora,"Inflação: O boletim Focus mostra queda, pela 4ª vez seguida do IPCA , de 6,27% para 6,23% na passagem semanal. Isso é bom p/ segurar juros.",CIMPEX LTDA,,False,95,36,2468,0,2,2,,False,[],[],0,0,0,0,pt,"<a href=""http://twitter.com"" rel=""nofollow"">Twitter Web Client</a>",,,,
569,2011-05-30 12:26:00+00:00,StoneX_Brasil,"Boletim Focus volta a apontar redução na projeção de IPCA para 2011. Expectativa de avanço nos preços é de 6,23% no ano.",StoneX Brasil,Consultoria em Futuros e Commodities. brasil.stonex.com | mercadosagricolas.com.br | dtvm.stonex.com | banco.stonex.com | asset.stonex.com,False,2186,149,15076,683,46,5049,Brasil,False,[],[],0,0,0,0,pt,"<a href=""https://about.twitter.com/products/tweetdeck"" rel=""nofollow"">TweetDeck</a>",,,,
570,2011-05-30 11:50:09+00:00,DailyBusinessBR,[#Economia] » Analistas reduzem expectativa de inflação pela 4ª semana seguida: Boletim Focus aponta ... http://bit.ly/jJhV7V #WhataNews,Daily Business BR,Whataheal Daily Business - #ECONOMIA | geekstech.com.br | Sua fonte inesgotável de informação sobre ECONOMIA e FINANÇAS.,False,156,193,33137,2,3,0,"São Paulo, SP",False,[],[],0,0,0,0,pt,"<a href=""http://twitterfeed.com"" rel=""nofollow"">twitterfeed</a>",,,,
571,2011-05-30 11:50:09+00:00,DailyBusinessBR,[#Economia] » Analistas reduzem expectativa de inflação pela 4ª semana seguida: Boletim Focus aponta ... http://bit.ly/jJhV7V #WhataNews,Daily Business BR,Whataheal Daily Business - #ECONOMIA | geekstech.com.br | Sua fonte inesgotável de informação sobre ECONOMIA e FINANÇAS.,False,156,193,33137,2,3,0,"São Paulo, SP",False,[],[],0,0,0,0,pt,"<a href=""http://twitterfeed.com"" rel=""nofollow"">twitterfeed</a>",,,,
572,2011-05-30 11:50:09+00:00,iramilso,"Analistas reduzem expectativa de inflação pela 4ª semana seguida: Boletim Focus aponta projeção de 6,23% para o ... http://bit.ly/mnqi6Y",Iramilso Santos,Militar do Exército. Sou graduado em História pela UFG.,False,119,61,310605,61,0,3,"Goiânia, Brasil",False,[],[],0,0,0,0,pt,"<a href=""http://twitterfeed.com"" rel=""nofollow"">twitterfeed</a>",,,,
573,2011-05-30 11:50:08+00:00,jansencosta,"Analistas reduzem expectativa de inflação pela 4ª semana seguida: Boletim Focus aponta projeção de 6,23% para o ... http://bit.ly/jwUFnr",Jansen da Costa,A arte da vida consiste em fazer da vida uma obra de arte.,False,231,127,73303,2,9,27,Rio de Janeiro,False,[],[],0,0,0,0,pt,"<a href=""http://twitterfeed.com"" rel=""nofollow"">twitterfeed</a>",,,,
574,2011-05-30 11:29:09+00:00,ClaudiaAugelli,"Hj tb sai a concessão de empréstimos em abril e o Boletim Focus, do BC, que deve mostrar nova redução nas expectativas de inflação p o ano.",Claudia Augelli,#MundoDoDinheiro Investimentos e Negócios | Money Manager & Investment Strategist 25+yrs 🇧🇷🇺🇸 #ImTheRealDeal 🔥,False,9778,550,2867,1025,53,278,Miami,False,[],[],0,0,0,0,pt,"<a href=""http://twitter.com"" rel=""nofollow"">Twitter Web Client</a>",,,,
575,2011-05-29 17:19:06+00:00,liveinfonews,"Focus: economistas reduzem estimativa de inflação pela 3ª semana: Os economistas ouvidos para o boletim Focus,... http://twurl.nl/alewki",liveinformationnews,Informativo sobre: comunicação e mkt + cultura + design + economia & mercado + estudos & pesquisas + curiosidades - Divirta-se!!!,False,149,440,2840,0,7,0,Brazil,False,[],[],0,0,0,0,pt,"<a href=""http://twitterfeed.com"" rel=""nofollow"">twitterfeed</a>",,,,
576,2011-05-27 20:23:13+00:00,realsardenberg,Boletim Focus do BC traz expectativa de queda da inflação: http://tinyurl.com/3mpscgc,Carlos A. Sardenberg,"Jornalista, âncora do programa CBN Brasil,  comentarista econômico no Jornal da Globo, Jornal das 10 (Globonews) e CBN.",True,500598,243,3161,90,939,114,Brasil - São Paulo,False,[],[],0,1,0,0,pt,"<a href=""http://erased227_bmcKz6AiS0.com"" rel=""nofollow"">erased227_bmcKz6AiS0</a>",,,,
577,2011-05-24 22:06:00+00:00,alagoasemfoco,"Pela 3ª semana seguida, mercado reduz previsão para inflação em 2011: Boletim Focus, do BC, aponta redução de 6,... http://glo.bo/kaUwE9",Alagoas em Foco,,False,96,26,53291,0,4,0,,False,[],[],0,0,0,0,pt,"<a href=""http://twitterfeed.com"" rel=""nofollow"">twitterfeed</a>",,,,
578,2011-05-24 11:49:15+00:00,ricismael,"Boletim Focus reduz previsão para inflação em 2011,estimada agora em 6,27%, e diz que crescimento este ano fica em 4%. http://bit.ly/mkFxJA",Ricardo Ismael,"Cientista Político PUC-Rio, Coordenador Laboratório Pesquisa Governo, Desenvolvimento e Equidade e Observador Conjuntura Política",False,328,54,5473,1,6,48,Rio de Janeiro,False,[],[],0,0,0,0,pt,"<a href=""http://twitter.com"" rel=""nofollow"">Twitter Web Client</a>",,,,
579,2011-05-23 18:50:22+00:00,timinhadavid,Estimativa da inflação oficial para 2011 tem terceira queda consecutiva: Especialistas do Boletim Focus apontam ... http://bit.ly/kiZOHW,fsdavi,,False,12,0,189316,0,1,0,,False,[],[],0,0,0,0,pt,"<a href=""http://twitterfeed.com"" rel=""nofollow"">twitterfeed</a>",,,,
580,2011-05-23 18:50:22+00:00,timinhadavid,Estimativa da inflação oficial para 2011 tem terceira queda consecutiva: Especialistas do Boletim Focus apontam ... http://bit.ly/kiZOHW,fsdavi,,False,12,0,189316,0,1,0,,False,[],[],0,0,0,0,pt,"<a href=""http://twitterfeed.com"" rel=""nofollow"">twitterfeed</a>",,,,
581,2011-05-23 18:49:33+00:00,scnoticias,Estimativa da inflação oficial para 2011 tem terceira queda consecutiva: Especialistas do Boletim Focus apontam ... http://bit.ly/jPiq48,Notícias de SC,Notícias dos principais veículos de comunicação de Santa Catarina.,False,1697,704,250404,0,61,0,"Florianópolis, SC",False,[],[],0,0,0,0,pt,"<a href=""http://twitterfeed.com"" rel=""nofollow"">twitterfeed</a>",,,,
582,2011-05-23 18:29:23+00:00,timinhadavid,Estimativa da inflação oficial para 2011 tem terceira queda consecutiva: Especialistas do Boletim Focus apontam ... http://bit.ly/kgHuL5,fsdavi,,False,12,0,189316,0,1,0,,False,[],[],0,0,0,0,pt,"<a href=""http://twitterfeed.com"" rel=""nofollow"">twitterfeed</a>",,,,
583,2011-05-23 18:29:21+00:00,ExnessPortugues,Estimativa da inflação oficial para 2011 tem terceira queda consecutiva: Especialistas do Boletim Focus apontam ... http://bit.ly/jfy80a,Exness Português,"O Grupo Exness foi fundado em 2008.
Licenças do Grupo Exness: FSA/SD025 - CySEC/178/12 - FCA UK/730729.
bit.ly/3AeOF65",False,13364,11245,389386,14,12,28022,Português,False,[],[],0,0,0,0,pt,"<a href=""http://twitterfeed.com"" rel=""nofollow"">twitterfeed</a>",,,,
584,2011-05-23 18:27:27+00:00,scnoticias,Estimativa da inflação oficial para 2011 tem terceira queda consecutiva: Especialistas do Boletim Focus apontam ... http://bit.ly/jYjhK0,Notícias de SC,Notícias dos principais veículos de comunicação de Santa Catarina.,False,1697,704,250404,0,61,0,"Florianópolis, SC",False,[],[],0,0,0,0,pt,"<a href=""http://twitterfeed.com"" rel=""nofollow"">twitterfeed</a>",,,,
585,2011-05-23 18:27:26+00:00,joinville_sc,Estimativa da inflação oficial para 2011 tem terceira queda consecutiva: Especialistas do Boletim Focus apontam ... http://bit.ly/jYjhK0,joinville sc,"Não somos um perfil oficial da cidade ou da prefeitura, somos apenas uma fonte de notícia",False,4089,117,21581,8,58,0,JOINVILLE - SC - BRASIL ,False,[],[],0,0,0,0,pt,"<a href=""http://twitterfeed.com"" rel=""nofollow"">twitterfeed</a>",,,,
586,2011-05-23 17:34:55+00:00,otaviojuliato,That´s good!! RT @FCStoneBrasil: Boletim Focus aponta nova queda na projeção da inflação de 2011.,Otávio Juliato,Entrepreneur • CCO at @omeletecompany biggest Geek outlet in Latin America | @omelete | @theenemybr | @ccxpoficial | @gamexpoficial | @gaules | @BIG_Festival,False,4377,99,8230,2560,17,456,"São Paulo, Brasil",False,[],[],0,0,0,0,pt,"<a href=""https://about.twitter.com/products/tweetdeck"" rel=""nofollow"">TweetDeck</a>",,,,
