,datetime,username,content,display name,user description,verified,follower count,friends count,statuses count,favourites count,listed count,media count,location,protected,outlinks,tcooutlinks,reply count,retweet count,like count,quote count,lang,source,media,retweeted tweet,quoted tweet,mentioned users
160,2017-04-28 16:44:10+00:00,AdemirBMJR,"@alonsocamello @Cassito_Z Acredito que as dividas também e atualizam pelo IGPM ao final do ano, assim como os valores dos contratos de TV. Mas o clube pode ter...",Ademir Bezerra de Melo Junior 🐏,"Pernambucano de Recife🦈, Comuna🇨🇳, torcedor do Sport Club do Recife🦁, Historiador✊",False,44,303,1930,4971,0,65,"Recife🦈, Brasil🇧🇷",False,[],[],1,0,0,0,pt,"<a href=""http://twitter.com"" rel=""nofollow"">Twitter Web Client</a>",,,,"[User(username='alonsocamello', id=166786331, displayname='Alonso Camello', rawDescription=None, renderedDescription=None, descriptionLinks=None, verified=None, created=None, followersCount=None, friendsCount=None, statusesCount=None, favouritesCount=None, listedCount=None, mediaCount=None, location=None, protected=None, link=None, profileImageUrl=None, profileBannerUrl=None, label=None), User(username='Cassito_Z', id=55254889, displayname='Cassio Zirpoli', rawDescription=None, renderedDescription=None, descriptionLinks=None, verified=None, created=None, followersCount=None, friendsCount=None, statusesCount=None, favouritesCount=None, listedCount=None, mediaCount=None, location=None, protected=None, link=None, profileImageUrl=None, profileBannerUrl=None, label=None)]"
161,2017-04-28 00:55:38+00:00,ofalador125,"@jornal_cultura @WillianCorrea @tvcultura O Brasil do Emerson Kapaz é este mesmo ? IGPM, queda do aluguel acho que sou de Marte",jose maria oliveira,"Atleticano,Ptista, locutor,sonhador e falador de tudo !",False,2474,2657,53998,4085,10,594,"Buritis, Belo Horizonte",False,[],[],1,0,1,0,pt,"<a href=""http://twitter.com/download/android"" rel=""nofollow"">Twitter for Android</a>",,,,"[User(username='jornal_cultura', id=126750296, displayname='Jornalismo TV Cultura', rawDescription=None, renderedDescription=None, descriptionLinks=None, verified=None, created=None, followersCount=None, friendsCount=None, statusesCount=None, favouritesCount=None, listedCount=None, mediaCount=None, location=None, protected=None, link=None, profileImageUrl=None, profileBannerUrl=None, label=None), User(username='WillianCorrea', id=134940201, displayname='Willian Corrêa', rawDescription=None, renderedDescription=None, descriptionLinks=None, verified=None, created=None, followersCount=None, friendsCount=None, statusesCount=None, favouritesCount=None, listedCount=None, mediaCount=None, location=None, protected=None, link=None, profileImageUrl=None, profileBannerUrl=None, label=None), User(username='tvcultura', id=14306125, displayname='TV Cultura', rawDescription=None, renderedDescription=None, descriptionLinks=None, verified=None, created=None, followersCount=None, friendsCount=None, statusesCount=None, favouritesCount=None, listedCount=None, mediaCount=None, location=None, protected=None, link=None, profileImageUrl=None, profileBannerUrl=None, label=None)]"
162,2017-04-27 18:55:28+00:00,rubensmenin,"Deflação em abril medida pelo IGPM que ficou em -1,1% era impensável alguns meses atrás. Mudanca está acontecendo mais rápido que o esperado",Rubens Menin,"Presidente do Conselho da @mrveco_oficial, @interbr, @log_oficial; @oficial_urba, @liveresia , @CNNBrasil, @ConediBR, @itatiaia",True,469373,1119,17951,318,243,2157,Belo Horizonte - MG - Brasil,False,[],[],3,12,32,0,pt,"<a href=""http://twitter.com/#!/download/ipad"" rel=""nofollow"">Twitter for iPad</a>",,,,
163,2017-04-27 18:54:06+00:00,rubensmenin,"Poucos estão dando importância, mas índice negativo de 1,1% do IGPM de abril abre enorme espaço para queda de juros e recuperação econômica",Rubens Menin,"Presidente do Conselho da @mrveco_oficial, @interbr, @log_oficial; @oficial_urba, @liveresia , @CNNBrasil, @ConediBR, @itatiaia",True,469373,1119,17951,318,243,2157,Belo Horizonte - MG - Brasil,False,[],[],0,16,36,0,pt,"<a href=""http://twitter.com/#!/download/ipad"" rel=""nofollow"">Twitter for iPad</a>",,,,
164,2017-04-27 12:05:54+00:00,DeniseCToledo8,"IGPM recua 1,10% em abril, o menor desde 98. Além da oferta de produtos básicos, baixa reflete desaceleração de atividade @portaljovempan",Denise C de Toledo,"Jornalista, palestrante, comentarista de Economia TV Gazeta, ex-Jovem Pan @denisecamposdetoledo no Instagram",True,36217,1527,18913,8467,172,3028,"São Paulo, Brasil",False,[],[],0,2,8,0,pt,"<a href=""http://twitter.com"" rel=""nofollow"">Twitter Web Client</a>",,,,"[User(username='portaljovempan', id=1244292630441328640, displayname='portaljovempan', rawDescription=None, renderedDescription=None, descriptionLinks=None, verified=None, created=None, followersCount=None, friendsCount=None, statusesCount=None, favouritesCount=None, listedCount=None, mediaCount=None, location=None, protected=None, link=None, profileImageUrl=None, profileBannerUrl=None, label=None)]"
165,2017-04-21 17:58:12+00:00,ToroRadar,Já ouviu falar em IGPM? Entenda agora como ele funciona! https://t.co/o84P5PVYQL https://t.co/Hddx706iG0,Toro Radar,Consultoria no Mercado Financeiro,False,1607,43,6055,180,25,4898,Belo Horizonte - MG - Brasil,False,['http://hubs.ly/H0779NJ0'],['https://t.co/o84P5PVYQL'],0,0,0,0,pt,"<a href=""http://www.hubspot.com/"" rel=""nofollow"">HubSpot</a>","[Photo(previewUrl='https://pbs.twimg.com/media/C99HQVtXUAAXPQA?format=jpg&name=small', fullUrl='https://pbs.twimg.com/media/C99HQVtXUAAXPQA?format=jpg&name=large', altText=None)]",,,
166,2017-04-20 12:26:30+00:00,nyongpique,Essa mudança de reajustar por igpm tá me deixando confusa.,pique de negona,como um girassol,False,693,284,68129,5967,2,1372,,False,[],[],0,0,0,0,pt,"<a href=""http://twitter.com/download/iphone"" rel=""nofollow"">Twitter for iPhone</a>",,,,
167,2017-04-12 14:49:15+00:00,CristianCupello,"@samydana Qual a previsão do Ipca e igpm para 2017?
Qual a fonte vc usa para buscar esses valores?",Cristian Cupello,,False,27,423,139,328,0,2,,False,[],[],1,0,0,0,pt,"<a href=""http://twitter.com/download/iphone"" rel=""nofollow"">Twitter for iPhone</a>",,,,"[User(username='samydana', id=34759495, displayname='Samy Dana', rawDescription=None, renderedDescription=None, descriptionLinks=None, verified=None, created=None, followersCount=None, friendsCount=None, statusesCount=None, favouritesCount=None, listedCount=None, mediaCount=None, location=None, protected=None, link=None, profileImageUrl=None, profileBannerUrl=None, label=None)]"
168,2017-04-09 15:20:51+00:00,samydana,@CristianCupello São índices de inflação O ipca é do Ibge a inflação do consumidor Já o IGPM é da FGV e tem um peso maior de preços do atacado,Samy Dana,Ph.D em Business. professor da FGV e comentarista econômico.,True,238418,928,28915,23550,787,1502,São Paulo,False,[],[],1,0,2,0,pt,"<a href=""http://twitter.com/download/iphone"" rel=""nofollow"">Twitter for iPhone</a>",,,,"[User(username='CristianCupello', id=175574345, displayname='Cristian Cupello', rawDescription=None, renderedDescription=None, descriptionLinks=None, verified=None, created=None, followersCount=None, friendsCount=None, statusesCount=None, favouritesCount=None, listedCount=None, mediaCount=None, location=None, protected=None, link=None, profileImageUrl=None, profileBannerUrl=None, label=None)]"
169,2017-04-09 14:30:14+00:00,CristianCupello,@samydana Oi Samy!!! Poderia me auxiliar de uma maneira didática a # entre IPCA e IGPM? Sou consultor financeiro isso me facilitaria muito!,Cristian Cupello,,False,27,423,139,328,0,2,,False,[],[],1,0,0,0,pt,"<a href=""http://twitter.com/download/iphone"" rel=""nofollow"">Twitter for iPhone</a>",,,,"[User(username='samydana', id=34759495, displayname='Samy Dana', rawDescription=None, renderedDescription=None, descriptionLinks=None, verified=None, created=None, followersCount=None, friendsCount=None, statusesCount=None, favouritesCount=None, listedCount=None, mediaCount=None, location=None, protected=None, link=None, profileImageUrl=None, profileBannerUrl=None, label=None)]"
170,2017-04-08 01:34:38+00:00,siiid,"@ryancociello menor inflação dos últimos 23 anos, IGPM de 0,01%... óbvio q o poder de compra aumenta. Nao q isso seja bom, mas não é errada a afirmação",sid,i dont care if these bitches dont like me cuz like i'm pretty as fuck,False,243,221,24639,59015,3,710,"São Paulo, Brasil",False,[],[],0,0,0,0,pt,"<a href=""http://twitter.com/download/iphone"" rel=""nofollow"">Twitter for iPhone</a>",,,,"[User(username='ryancociello', id=1303722944431091712, displayname='angústia homogeneizante', rawDescription=None, renderedDescription=None, descriptionLinks=None, verified=None, created=None, followersCount=None, friendsCount=None, statusesCount=None, favouritesCount=None, listedCount=None, mediaCount=None, location=None, protected=None, link=None, profileImageUrl=None, profileBannerUrl=None, label=None)]"
171,2017-04-05 10:50:01+00:00,imob_io,"Acompanha o valor do igpm , fale com o nosso bot!
https://t.co/A3dnj4Is9F https://t.co/amgDRVx9ZM",Imob.io,,False,661,867,2975,451,1,2203,"São Paulo, Brasil",False,['http://goo.gl/s8V8PW'],['https://t.co/A3dnj4Is9F'],0,0,0,0,pt,"<a href=""http://twitter.com"" rel=""nofollow"">Twitter Web Client</a>","[Photo(previewUrl='https://pbs.twimg.com/media/C8pLdMPXgAABu6E?format=png&name=small', fullUrl='https://pbs.twimg.com/media/C8pLdMPXgAABu6E?format=png&name=large', altText=None)]",,,
172,2017-04-03 20:13:02+00:00,ToroRadar,Já ouviu falar em IGPM? Entenda agora como ele funciona! https://t.co/1MIBa3kUBt https://t.co/U01pVqYwZk,Toro Radar,Consultoria no Mercado Financeiro,False,1607,43,6055,180,25,4898,Belo Horizonte - MG - Brasil,False,['http://hubs.ly/H06W7P00'],['https://t.co/1MIBa3kUBt'],0,0,1,0,pt,"<a href=""http://www.hubspot.com/"" rel=""nofollow"">HubSpot</a>","[Photo(previewUrl='https://pbs.twimg.com/media/C8g5gFAWsAIHQX2?format=jpg&name=small', fullUrl='https://pbs.twimg.com/media/C8g5gFAWsAIHQX2?format=jpg&name=large', altText=None)]",,,
173,2017-04-01 19:44:06+00:00,HeitorDPorto,"@OGlobo_Rio @JornalOGlobo EU PROPUS. UNIFICAR SALÁRIOS PROCEDIMENTOS,QUALIFICAÇÃO,FORMAÇÃO E TREINAMENTO DAS POLÍCIAS. IGPM? O NACIONALISTA.",Heitor Porto,,False,3,20,2739,34,0,0,,False,[],[],0,0,0,0,pt,"<a href=""http://twitter.com/download/android"" rel=""nofollow"">Twitter for Android</a>",,,,"[User(username='OGlobo_Rio', id=66441430, displayname='O Globo_Rio', rawDescription=None, renderedDescription=None, descriptionLinks=None, verified=None, created=None, followersCount=None, friendsCount=None, statusesCount=None, favouritesCount=None, listedCount=None, mediaCount=None, location=None, protected=None, link=None, profileImageUrl=None, profileBannerUrl=None, label=None), User(username='JornalOGlobo', id=54341363, displayname='Jornal O Globo', rawDescription=None, renderedDescription=None, descriptionLinks=None, verified=None, created=None, followersCount=None, friendsCount=None, statusesCount=None, favouritesCount=None, listedCount=None, mediaCount=None, location=None, protected=None, link=None, profileImageUrl=None, profileBannerUrl=None, label=None)]"
174,2017-03-31 19:30:18+00:00,HeitorDPorto,"@BlogdoNoblat @Estadao UNIFICAR SALÁRIOS,PROCEDIMENTOS,QUALIFICAÇÃO,FORMAÇÃO E TREINAMENTO. GENERAL GLÁUCIO,IGPM? O NACIONALISTA.",Heitor Porto,,False,3,20,2739,34,0,0,,False,[],[],0,0,0,0,pt,"<a href=""http://twitter.com/download/android"" rel=""nofollow"">Twitter for Android</a>",,,,"[User(username='BlogdoNoblat', id=16794066, displayname='Blog do Noblat', rawDescription=None, renderedDescription=None, descriptionLinks=None, verified=None, created=None, followersCount=None, friendsCount=None, statusesCount=None, favouritesCount=None, listedCount=None, mediaCount=None, location=None, protected=None, link=None, profileImageUrl=None, profileBannerUrl=None, label=None), User(username='Estadao', id=9317502, displayname='Estadão 🗞️', rawDescription=None, renderedDescription=None, descriptionLinks=None, verified=None, created=None, followersCount=None, friendsCount=None, statusesCount=None, favouritesCount=None, listedCount=None, mediaCount=None, location=None, protected=None, link=None, profileImageUrl=None, profileBannerUrl=None, label=None)]"
175,2017-03-30 18:28:21+00:00,dervilleimoveis,Reajuste de aluguel para contratos de abril de 2017 com IGPM de março de 2017 https://t.co/qbuSsFCUDq https://t.co/IXYrOpgy67,Derville Imóveis,"41 99822 3411 derville@dervilleimoveis.com.br Compra e Venda, Administração, Locação e Avaliação Imobiliária (Perito CNAI 09297) CRECI 07574 J PR",False,1830,4670,2814,288,19,684,Curitiba - Paraná - Brasil,False,['https://deimoveis.wordpress.com/2017/03/30/reajuste-de-aluguel-para-contratos-de-abril-de-2017-com-igpm-de-marco-de-2017'],['https://t.co/qbuSsFCUDq'],0,1,2,0,pt,"<a href=""http://publicize.wp.com/"" rel=""nofollow"">Jetpack.com</a>","[Photo(previewUrl='https://pbs.twimg.com/media/C8L7LoTUwAAK8lY?format=jpg&name=small', fullUrl='https://pbs.twimg.com/media/C8L7LoTUwAAK8lY?format=jpg&name=large', altText=None)]",,,
176,2017-03-30 12:26:36+00:00,clear_corretora,"#MorningCall Agenda: 8h, IGPM e 9h, vendas no varejo. EUA: 9h30, PIB e seguro desemprego. Falas de dirigentes do Fed durante o dia.",Clear Corretora,💪 Investir na Bolsa pode ser PRA VOCÊ! Abra sua conta e tenha a melhor experiência de Renda Variável com corretagem ZERO em todos os produtos.,True,27090,26,7911,282,209,287,,False,[],[],0,0,0,0,pt,"<a href=""http://twitter.com"" rel=""nofollow"">Twitter Web Client</a>",,,,
177,2017-03-30 12:14:42+00:00,PrateleiraA,"A inflação medida pelo principal indexador dos contratos de imóveis, o IGPM, fechou o mês de… https://t.co/fJ7yLZ2qt2",Felipe Tejeda,Assessor de investimentos na XP e sócio da Arcani Investimentos,False,1172,355,910,449,25,224,Brasil,False,['https://www.instagram.com/p/BSQwsU8hv9h/'],['https://t.co/fJ7yLZ2qt2'],0,0,1,0,pt,"<a href=""http://instagram.com"" rel=""nofollow"">Instagram</a>",,,,
178,2017-03-27 14:21:43+00:00,esperleon,"A @NEToficial consegue fazer o reajuste de IGPM sobre R$ 0,00 (isenção) se transformar em R$ 83,80!!!!! https://t.co/imYwIp7cYB",Esper Leon,Oncotô? Doncovi? Proncovô?,False,1591,371,56300,19646,31,5521,São Paulo,False,['https://twitter.com/esperleon/status/846365464880123905'],['https://t.co/imYwIp7cYB'],0,0,1,0,pt,"<a href=""http://twitter.com"" rel=""nofollow"">Twitter Web Client</a>",,,https://twitter.com/esperleon/status/846365464880123905,"[User(username='NEToficial', id=38665133, displayname='NET', rawDescription=None, renderedDescription=None, descriptionLinks=None, verified=None, created=None, followersCount=None, friendsCount=None, statusesCount=None, favouritesCount=None, listedCount=None, mediaCount=None, location=None, protected=None, link=None, profileImageUrl=None, profileBannerUrl=None, label=None)]"
179,2017-03-24 13:50:11+00:00,blogpedroneto,"@HudsonRegis Pelo IGPM tranquilo Hudson. Mas, você deve saber que não é o caso. Seria de banco. Nenhum banco empresta pelo IGPM. Valeu.",Pedro Neto,"Jornalista. Comentarista Esportivo das TVs, Metropolitano e Câmara de Natal. Colunista do Jornal AGORA RN.
Eu não discuto com idiotas, apenas dou block.",False,6687,124,55585,19358,16,883,,False,[],[],0,0,0,0,pt,"<a href=""http://twitter.com/download/android"" rel=""nofollow"">Twitter for Android</a>",,,,"[User(username='HudsonRegis', id=44399978, displayname='🇧🇷Hudson Regis🇧🇷', rawDescription=None, renderedDescription=None, descriptionLinks=None, verified=None, created=None, followersCount=None, friendsCount=None, statusesCount=None, favouritesCount=None, listedCount=None, mediaCount=None, location=None, protected=None, link=None, profileImageUrl=None, profileBannerUrl=None, label=None)]"
180,2017-03-23 18:55:50+00:00,Marreyy,"Vendo Terreno Plano, Condomínio Euroville II, Bragança Paulista SP – 10% Entrada e Saldo 72 x Sem Juros só IGPM - Marrey (11) 97326-0445",Marrey Imóveis,Venda de Imóveis em Bragança Paulista SP,False,39,23,3002,7,1,861,Brazil,False,[],[],0,0,0,0,pt,"<a href=""http://www.facebook.com/twitter"" rel=""nofollow"">Facebook</a>",,,,
181,2017-03-23 16:22:59+00:00,PabloSantana83,"@MarcosPoAlegre @GuascadeFora @juremirm Dá uma ""desalienada"" e te informa sobre a SELIC e IGPM e IPCA. Depois volte a este guichê.",Pablo Inclemente,Há incautos na praça que dizem que a megalomania me engoliu. Rotundo engano. Eu a engoli há décadas. Perfil em homenagem ao meu amigo e mestre Paulo Santana.,False,36,388,963,196,0,7,Píncaros da lua,False,[],[],0,0,0,0,pt,"<a href=""http://twitter.com"" rel=""nofollow"">Twitter Web Client</a>",,,,"[User(username='GuascadeFora', id=295365203, displayname='Trabalhadores, conectai-vos.', rawDescription=None, renderedDescription=None, descriptionLinks=None, verified=None, created=None, followersCount=None, friendsCount=None, statusesCount=None, favouritesCount=None, listedCount=None, mediaCount=None, location=None, protected=None, link=None, profileImageUrl=None, profileBannerUrl=None, label=None), User(username='juremirm', id=85611444, displayname='Juremir Machado da Silva', rawDescription=None, renderedDescription=None, descriptionLinks=None, verified=None, created=None, followersCount=None, friendsCount=None, statusesCount=None, favouritesCount=None, listedCount=None, mediaCount=None, location=None, protected=None, link=None, profileImageUrl=None, profileBannerUrl=None, label=None)]"
182,2017-03-23 14:48:34+00:00,Marreyy,"Vendo Terreno Plano, Condomínio Euroville II, Bragança Paulista SP – 10% Entrada e Saldo 72 x Sem Juros só IGPM -... https://t.co/bZGVqJ22DZ",Marrey Imóveis,Venda de Imóveis em Bragança Paulista SP,False,39,23,3002,7,1,861,Brazil,False,['http://fb.me/3tzpNyOsO'],['https://t.co/bZGVqJ22DZ'],0,0,0,0,pt,"<a href=""http://www.facebook.com/twitter"" rel=""nofollow"">Facebook</a>",,,,
183,2017-03-23 14:06:10+00:00,PabloSantana83,@GuascadeFora @juremirm Você lê jornais? Já viu que a Selic despenca a cada reunião do COPOM? E a inflação? Tem acompanhado IGPM e IPCA?,Pablo Inclemente,Há incautos na praça que dizem que a megalomania me engoliu. Rotundo engano. Eu a engoli há décadas. Perfil em homenagem ao meu amigo e mestre Paulo Santana.,False,36,388,963,196,0,7,Píncaros da lua,False,[],[],0,0,0,0,pt,"<a href=""http://twitter.com"" rel=""nofollow"">Twitter Web Client</a>",,,,"[User(username='GuascadeFora', id=295365203, displayname='Trabalhadores, conectai-vos.', rawDescription=None, renderedDescription=None, descriptionLinks=None, verified=None, created=None, followersCount=None, friendsCount=None, statusesCount=None, favouritesCount=None, listedCount=None, mediaCount=None, location=None, protected=None, link=None, profileImageUrl=None, profileBannerUrl=None, label=None), User(username='juremirm', id=85611444, displayname='Juremir Machado da Silva', rawDescription=None, renderedDescription=None, descriptionLinks=None, verified=None, created=None, followersCount=None, friendsCount=None, statusesCount=None, favouritesCount=None, listedCount=None, mediaCount=None, location=None, protected=None, link=None, profileImageUrl=None, profileBannerUrl=None, label=None)]"
184,2017-03-21 11:11:43+00:00,SuperVia_trens,"@AmIMorgado (+) e a correção anual da tarifa com base na inflação (IGPM), ambas previstas no contrato de concessão",SuperVia,"Perfil oficial da SuperVia Trens.
Tweets ofensivos não serão respondidos e seu autor será silenciado.",True,174667,462,364711,3465,510,2570,,False,[],[],0,0,0,0,pt,"<a href=""https://about.twitter.com/products/tweetdeck"" rel=""nofollow"">TweetDeck</a>",,,,
185,2017-03-17 22:54:01+00:00,NETatende,@stanfeatdido_ Olá! O valor da fatura mudou pois foi aplicado o reajuste anual das mensalidades dos contratos da NET com base no IGPM.,netatende,"A NET está na Claro! Para tirar suas dúvidas sobre nossos produtos, fale conosco em @ClaroBrasil. Estaremos lá, prontos para atendê-lo, 24h por dia. 😉",True,81289,51844,628113,15,193,21,Brasil,False,[],[],1,0,0,0,pt,"<a href=""http://www.scup.com"" rel=""nofollow"">Scup</a>",,,,
186,2017-03-17 13:46:35+00:00,Circuitopta,"Índice que reajusta aluguéis acumula taxa de 4,92% em 12 meses #Economia #FGV #FundaçãoGetulioVargas #IGPM #marco https://t.co/kqCo6jkHh6",Circuito Paulista,,False,312,1623,16704,1,0,133,Presidente Prudente,False,['http://fb.me/1MpJbfHRK'],['https://t.co/kqCo6jkHh6'],0,0,0,0,pt,"<a href=""http://www.facebook.com/twitter"" rel=""nofollow"">Facebook</a>",,,,
187,2017-03-17 12:44:28+00:00,Circuitopta,"IGP-M avança 0,08% na 2ª prévia de março com queda menor no atacado, diz FGV #Economia #FGV #IGPM #INCC #IPA https://t.co/3TZxmdCGav",Circuito Paulista,,False,312,1623,16704,1,0,133,Presidente Prudente,False,['http://fb.me/12BVuLALz'],['https://t.co/3TZxmdCGav'],0,0,0,0,pt,"<a href=""http://www.facebook.com/twitter"" rel=""nofollow"">Facebook</a>",,,,
188,2017-03-11 13:39:17+00:00,agaatharosa,Ufa até que enfim saiu esse reajuste do IGPM,Htha ♓,"Brasilian, 21. Esteticista                                             
snap👻 e insta📷 @agaatharosa                                

COFRE FORTE É O CORAÇÃO ❤",False,224,202,25850,1740,17,213,"Mogi das Cruzes, SP",False,[],[],0,0,0,0,pt,"<a href=""http://twitter.com/download/android"" rel=""nofollow"">Twitter for Android</a>",,,,
189,2017-03-10 22:12:03+00:00,ToroRadar,Já ouviu falar em IGPM? Entenda agora como ele funciona! https://t.co/ui35u4W5bC https://t.co/HrUZH2Ck73,Toro Radar,Consultoria no Mercado Financeiro,False,1607,43,6055,180,25,4898,Belo Horizonte - MG - Brasil,False,['http://hubs.ly/H06zZfk0'],['https://t.co/ui35u4W5bC'],0,0,1,0,pt,"<a href=""http://www.hubspot.com/"" rel=""nofollow"">HubSpot</a>","[Photo(previewUrl='https://pbs.twimg.com/media/C6lullWXAAAZ_X2?format=jpg&name=small', fullUrl='https://pbs.twimg.com/media/C6lullWXAAAZ_X2?format=jpg&name=large', altText=None)]",,,
190,2017-03-10 03:06:13+00:00,NETatende,@asierrp Olá! O valor da fatura mudou pois foi aplicado o reajuste anual das mensalidades dos contratos da NET com base no IGPM.,netatende,"A NET está na Claro! Para tirar suas dúvidas sobre nossos produtos, fale conosco em @ClaroBrasil. Estaremos lá, prontos para atendê-lo, 24h por dia. 😉",True,81289,51844,628113,15,193,21,Brasil,False,[],[],0,0,0,0,pt,"<a href=""http://www.scup.com"" rel=""nofollow"">Scup</a>",,,,"[User(username='asierrp', id=1325801216, displayname='Asier Robredo', rawDescription=None, renderedDescription=None, descriptionLinks=None, verified=None, created=None, followersCount=None, friendsCount=None, statusesCount=None, favouritesCount=None, listedCount=None, mediaCount=None, location=None, protected=None, link=None, profileImageUrl=None, profileBannerUrl=None, label=None)]"
191,2017-03-08 17:19:37+00:00,machadooana_,"Prestei continência para o Policial que me deu aula de igpm, e ele logo respondeu..Os gringos ficaram olhando com uma cara tipo ""q loucura""😂",Ana Machado,"Manezinha, apaixonada pelo Avai. 🏖",False,1190,691,117963,43436,5,137,Campeche ,False,[],[],0,0,0,0,pt,"<a href=""http://twitter.com/download/iphone"" rel=""nofollow"">Twitter for iPhone</a>",,,,
192,2017-03-08 17:12:49+00:00,machadooana_,IGPM- Instrução Geral da Polícia Militar 😌🙌🏻,Ana Machado,"Manezinha, apaixonada pelo Avai. 🏖",False,1190,691,117963,43436,5,137,Campeche ,False,[],[],0,0,0,0,pt,"<a href=""http://twitter.com/download/iphone"" rel=""nofollow"">Twitter for iPhone</a>",,,,
193,2017-03-06 20:58:07+00:00,Mark_HRS,@Heliarly o esquema é banco de pequeno/médio porte. Mas tô na dúvida entre tesouro direto e lci/ipca x igpm,Mark,A orgia da vida fascina.,False,925,828,59384,4979,4,572,Beagá(UAI),False,[],[],0,0,0,0,pt,"<a href=""http://twitter.com/download/android"" rel=""nofollow"">Twitter for Android</a>",,,,
194,2017-03-04 23:48:41+00:00,ateliedasletras,Ah se as pessoas soubessem o poder do IGPM! 🙈,Edelise Gabardo,Instagram: @ateliedasletras,False,315,47,5511,169,3,90,Apucarana,False,[],[],0,0,0,0,pt,"<a href=""http://www.facebook.com/twitter"" rel=""nofollow"">Facebook</a>",,,,
195,2017-03-02 13:45:51+00:00,Annemagali,O IGPM de fevereiro podia sair logo pra agilizar minha vida aqui né 🙄🙄,Anne Caroline,"Aqui a reclamação está sempre em dia, mas pense numa pessoa top! 🍃",False,131,223,9602,8612,1,394,Brasília,False,[],[],0,0,0,0,pt,"<a href=""http://twitter.com"" rel=""nofollow"">Twitter Web Client</a>",,,,
196,2017-03-01 16:15:15+00:00,itau,"@vitimabc Olá. Na parcela do plano há a correção anual pelo IGPM e ao final dos 48 pagamentos, receberá a devolução de todo o valor pago.",Itaú,Esse espaço é #FeitoCom você. 🧡,True,680395,35,693833,15023,769,5152,,False,[],[],1,0,1,0,pt,"<a href=""https://www.itau.com.br"" rel=""nofollow"">Genesys IWS 01</a>",,,,"[User(username='VitimAbc', id=1546457648421343232, displayname='Vitim Abc', rawDescription=None, renderedDescription=None, descriptionLinks=None, verified=None, created=None, followersCount=None, friendsCount=None, statusesCount=None, favouritesCount=None, listedCount=None, mediaCount=None, location=None, protected=None, link=None, profileImageUrl=None, profileBannerUrl=None, label=None)]"
