,datetime,username,content,display name,user description,verified,follower count,friends count,statuses count,favourites count,listed count,media count,location,protected,outlinks,tcooutlinks,reply count,retweet count,like count,quote count,lang,source,media,retweeted tweet,quoted tweet,mentioned users
65,2019-11-11 23:57:46+00:00,slsoares,"@JeferSelva @ArthurWeint Veja quem foram os últimos diretores do Banco Central e Ministros da Fazenda.Ilan Goldfajn,Joaquim Levy,Henrique Meirelles.Bacen sempre nas mãos de banqueiros privados.Raposa com a chave do galinheiro ;o que será que fazem?Fed americano foi criado para privatizar o $$$ públco.",slsoares,"#Meu ÚNICO partido* , BRASIL  , The Great Awake",False,1705,3232,17125,5487,4,3396,Rio de Janeiro,False,[],[],0,0,0,0,pt,"<a href=""https://mobile.twitter.com"" rel=""nofollow"">Twitter Web App</a>",,,,"[User(username='JeferSelva', id=1035260466723995649, displayname='Jacinto Raiva 🤬', rawDescription=None, renderedDescription=None, descriptionLinks=None, verified=None, created=None, followersCount=None, friendsCount=None, statusesCount=None, favouritesCount=None, listedCount=None, mediaCount=None, location=None, protected=None, link=None, profileImageUrl=None, profileBannerUrl=None, label=None), User(username='ArthurWeint', id=1074209186752413696, displayname='Arthur Weintraub', rawDescription=None, renderedDescription=None, descriptionLinks=None, verified=None, created=None, followersCount=None, friendsCount=None, statusesCount=None, favouritesCount=None, listedCount=None, mediaCount=None, location=None, protected=None, link=None, profileImageUrl=None, profileBannerUrl=None, label=None)]"
66,2019-11-08 14:26:14+00:00,politicasemfato,Manuela d'Ávila e Ilan Goldfajn debatem sobre a reforma agrária.,PolíticasemFato,"Cansado de fake news viesadas, pagas por partidos políticos? Bem-vindo à PolíticasemFato, a primeira agência de fake news política 100% isenta e imparcial.",False,2777,60,78083,560,9,80,"Rua da Assembléia, 10",False,[],[],0,0,0,0,pt,"<a href=""http://twitter.com/politicasemfato"" rel=""nofollow"">politicasemfato</a>",,,,
67,2019-10-30 22:56:20+00:00,danieljosebr,"A mudança começou em 2016 com Henrique Meirelles (na fazenda) e Ilan Goldfajn (no Banco Central) no governo Temer. 

Depois tocaram a bola pra Paulo Guedes e Roberto Campos.",Daniel José,Deputado mais econômico da história de SP. R$ 8 mi economizados. Autor da Lei que pode transformar a educação no país. Mestre @Yale e Economista @Insper.,True,51548,318,8438,5843,197,533,"Sao Paulo, Brazil",False,[],[],7,20,296,1,pt,"<a href=""http://twitter.com/download/iphone"" rel=""nofollow"">Twitter for iPhone</a>",,,,
68,2019-10-29 09:26:14+00:00,politicasemfato,João Amoedo convida Ilan Goldfajn para conversar sobre previdência.,PolíticasemFato,"Cansado de fake news viesadas, pagas por partidos políticos? Bem-vindo à PolíticasemFato, a primeira agência de fake news política 100% isenta e imparcial.",False,2777,60,78083,560,9,80,"Rua da Assembléia, 10",False,[],[],0,0,0,0,pt,"<a href=""http://twitter.com/politicasemfato"" rel=""nofollow"">politicasemfato</a>",,,,
69,2019-10-27 19:53:37+00:00,FelipeSalto,"Na sexta (25/10), a convite da Regina Esteves , do @ComunitasBR, mediei um debate incrível sobre crescimento econômico e saídas para a crise. Participaram os ex-presidentes do BC Henrique Meirelles e Ilan Goldfajn e os governadores Helder Barbalho, Ronaldo Caiado e Romeu Zema. https://t.co/yOdkCFKvGm",Felipe Salto,Economista-chefe/sócio da @renascencaDTVM/@warrenbrasil. Ex-Secretário da Fazenda e Planejamento SP. 1° Diretor-Executivo da IFI. Colunista @estadao. Prof. IDP.,True,60709,4153,23921,45277,440,1735,"São Paulo, Brasil",False,[],[],0,2,15,0,pt,"<a href=""http://twitter.com/download/iphone"" rel=""nofollow"">Twitter for iPhone</a>","[Photo(previewUrl='https://pbs.twimg.com/media/EH6OvINXYAAGNS9?format=jpg&name=small', fullUrl='https://pbs.twimg.com/media/EH6OvINXYAAGNS9?format=jpg&name=large', altText=None), Photo(previewUrl='https://pbs.twimg.com/media/EH6OvIOX4AEA9Nh?format=jpg&name=small', fullUrl='https://pbs.twimg.com/media/EH6OvIOX4AEA9Nh?format=jpg&name=large', altText=None), Photo(previewUrl='https://pbs.twimg.com/media/EH6OvIPWwAE-hc_?format=jpg&name=small', fullUrl='https://pbs.twimg.com/media/EH6OvIPWwAE-hc_?format=jpg&name=large', altText=None)]",,,"[User(username='ComunitasBR', id=3387848369, displayname='Comunitas', rawDescription=None, renderedDescription=None, descriptionLinks=None, verified=None, created=None, followersCount=None, friendsCount=None, statusesCount=None, favouritesCount=None, listedCount=None, mediaCount=None, location=None, protected=None, link=None, profileImageUrl=None, profileBannerUrl=None, label=None)]"
70,2019-10-27 08:26:14+00:00,politicasemfato,Geraldo Alckmin e Ilan Goldfajn debatem sobre a reforma agrária.,PolíticasemFato,"Cansado de fake news viesadas, pagas por partidos políticos? Bem-vindo à PolíticasemFato, a primeira agência de fake news política 100% isenta e imparcial.",False,2777,60,78083,560,9,80,"Rua da Assembléia, 10",False,[],[],0,0,0,0,pt,"<a href=""http://twitter.com/politicasemfato"" rel=""nofollow"">politicasemfato</a>",,,,
71,2019-10-26 00:59:56+00:00,vncarrasco,Que espetacular iniciativa das gestões de Ilan Goldfajn e Roberto Campos Neto de dar acesso a dados para trabalhos como o do Gustavo.,Vinicius Carrasco,"Economist with interests in Market and Mechanism Design, Corporate Finance and Industrial Organization. Views are my own.",False,5698,1221,12532,3836,89,235,,False,[],[],1,0,4,0,pt,"<a href=""http://twitter.com/download/iphone"" rel=""nofollow"">Twitter for iPhone</a>",,,,
72,2019-10-25 12:23:00+00:00,FelipeSalto,"Participo agora pela manhã do 12° Encontro de Líderes do @ComunitasBR. Vou mediar o painel com @meirelles, Ilan Goldfajn, @ronaldocaiado, @helderbarbalho e @RomeuZema. Em discussão, estratégias para o crescimento econômico.",Felipe Salto,Economista-chefe/sócio da @renascencaDTVM/@warrenbrasil. Ex-Secretário da Fazenda e Planejamento SP. 1° Diretor-Executivo da IFI. Colunista @estadao. Prof. IDP.,True,60709,4153,23921,45277,440,1735,"São Paulo, Brasil",False,[],[],1,1,15,1,pt,"<a href=""http://twitter.com/download/android"" rel=""nofollow"">Twitter for Android</a>",,,,"[User(username='ComunitasBR', id=3387848369, displayname='Comunitas', rawDescription=None, renderedDescription=None, descriptionLinks=None, verified=None, created=None, followersCount=None, friendsCount=None, statusesCount=None, favouritesCount=None, listedCount=None, mediaCount=None, location=None, protected=None, link=None, profileImageUrl=None, profileBannerUrl=None, label=None), User(username='meirelles', id=870030409890910210, displayname='Henrique Meirelles', rawDescription=None, renderedDescription=None, descriptionLinks=None, verified=None, created=None, followersCount=None, friendsCount=None, statusesCount=None, favouritesCount=None, listedCount=None, mediaCount=None, location=None, protected=None, link=None, profileImageUrl=None, profileBannerUrl=None, label=None), User(username='ronaldocaiado', id=32101740, displayname='Ronaldo Caiado', rawDescription=None, renderedDescription=None, descriptionLinks=None, verified=None, created=None, followersCount=None, friendsCount=None, statusesCount=None, favouritesCount=None, listedCount=None, mediaCount=None, location=None, protected=None, link=None, profileImageUrl=None, profileBannerUrl=None, label=None), User(username='helderbarbalho', id=151653693, displayname='Helder Barbalho', rawDescription=None, renderedDescription=None, descriptionLinks=None, verified=None, created=None, followersCount=None, friendsCount=None, statusesCount=None, favouritesCount=None, listedCount=None, mediaCount=None, location=None, protected=None, link=None, profileImageUrl=None, profileBannerUrl=None, label=None), User(username='RomeuZema', id=1020798087449776128, displayname='Zema 30', rawDescription=None, renderedDescription=None, descriptionLinks=None, verified=None, created=None, followersCount=None, friendsCount=None, statusesCount=None, favouritesCount=None, listedCount=None, mediaCount=None, location=None, protected=None, link=None, profileImageUrl=None, profileBannerUrl=None, label=None)]"
73,2019-10-22 06:26:14+00:00,politicasemfato,"Ilan Goldfajn: ""Meu partido é o Brasil. Ajudo no que puder""",PolíticasemFato,"Cansado de fake news viesadas, pagas por partidos políticos? Bem-vindo à PolíticasemFato, a primeira agência de fake news política 100% isenta e imparcial.",False,2777,60,78083,560,9,80,"Rua da Assembléia, 10",False,[],[],0,0,0,0,pt,"<a href=""http://twitter.com/politicasemfato"" rel=""nofollow"">politicasemfato</a>",,,,
74,2019-10-21 23:28:00+00:00,leosiqueirabr,"Para quem acha que o Brasil vai decolar por causa da Selic a 4% e juros reais entre 1% e 2%, vamos com calma...

1. Vale a pena explicar o termo Mexicanização da Economia Brasileira. 

O Termo foi criado por Ilan Goldfajn em 2006, quando ainda Diretor do BC. 

Segue...",Leo Siqueira,DEPUTADO ESTADUAL COM 90.688 votos em SP | Economista EESP/FGV | Mestrado Economia @bse_barcelona,False,53691,1075,8495,4770,335,875,"Sao Paulo, Brazil",False,[],[],20,135,726,19,pt,"<a href=""http://twitter.com/download/iphone"" rel=""nofollow"">Twitter for iPhone</a>",,,,
75,2019-10-21 18:00:00+00:00,valoreconomico,"Juro mais baixo veio para ficar, afirma Ilan Goldfajn

https://t.co/m75zwBCgiP",Valor Econômico,"A mais completa e admirada cobertura de economia, negócios e finanças. Notícias que geram negócios.",True,2623993,147,209670,0,8441,2902,Brasil,False,['https://valor.globo.com/financas/noticia/2019/10/21/juro-mais-baixo-veio-para-ficar-afirma-ilan.ghtml'],['https://t.co/m75zwBCgiP'],7,8,50,3,pt,"<a href=""https://about.twitter.com/products/tweetdeck"" rel=""nofollow"">TweetDeck</a>",,,,
76,2019-10-21 12:05:03+00:00,apoIogeta,"Entrevista com Ilan Goldfajn:

Juro mais baixo veio para ficar, afirma Ilan https://t.co/4UZAVMvLmF",Apô,"Já fui chamado de muitas coisas, inclusive de apologeta™ do neoliberalismo. Aqui eu comento sobre economia, política, esportes e alguns assuntos mais leves.",False,180,249,21562,848,1,1329,,False,['https://valor.globo.com/financas/noticia/2019/10/21/juro-mais-baixo-veio-para-ficar-afirma-ilan.ghtml'],['https://t.co/4UZAVMvLmF'],0,0,0,0,pt,"<a href=""http://twitter.com"" rel=""nofollow"">Twitter Web Client</a>",,,,
77,2019-10-10 15:00:44+00:00,ricardodecampos,"Ilan Goldfajn agora como executivo do Credit Suisse dá sua 1a palestra. Inflaçao e Juros baixos vieram p ficar, dólar nao vai cair e bolsa é o ativo mais beneficiado. Crescimento agora é via setor privado ao invés público e deve surpreender p cima. Óbvio porém muito bem colocado. https://t.co/R1xYNaQFvP",Ricardo Campos,CIO @reach_capital,False,2770,445,850,2599,42,152,,False,[],[],1,3,63,0,pt,"<a href=""http://twitter.com/download/iphone"" rel=""nofollow"">Twitter for iPhone</a>","[Photo(previewUrl='https://pbs.twimg.com/media/EGhoqDkXkAEi_SH?format=jpg&name=small', fullUrl='https://pbs.twimg.com/media/EGhoqDkXkAEi_SH?format=jpg&name=large', altText=None)]",,,
78,2019-10-09 19:26:52+00:00,rnplemos,"Inflação dentro da meta.
Uma herança de Ilan Goldfajn para o Brasil.

Espero que perdure.",Rafael L.,MSc Money and Finance - Goethe Frankfurt University,False,175,586,2000,5115,5,272,"Frankfurt am Main, Deutschland",False,[],[],0,0,2,0,pt,"<a href=""https://mobile.twitter.com"" rel=""nofollow"">Twitter Web App</a>",,,https://twitter.com/rvitoria/status/1181990391278657536,
79,2019-09-25 11:49:17+00:00,carloslopesjorn,"O presidente do BNDES, Gustavo Montezano, recebe, às 9h, no Rio de Janeiro, o presidente do Credit Suisse Brasil, José Olympio, e o presidente do Conselho Credit Suisse Brasil, Ilan Goldfajn, ex-presidente do Banco Central.",Carlos Lopes,Jornalista com atuação na área de informação e análise,False,494,340,28077,4769,26,135,"Brasilia, DF",False,[],[],0,0,0,0,pt,"<a href=""https://mobile.twitter.com"" rel=""nofollow"">Twitter Web App</a>",,,,
80,2019-09-17 14:00:22+00:00,coisasjudaicas,Ilan Goldfajn vai trabalhar no Credit Suisse: Ex-presidente do Banco… https://t.co/crKCgDL5Hi #coisas judaicas,Coisas Judaicas,Coisas Judaicas,False,1128,183,17244,66,12,47,Brasil,False,['https://goo.gl/fb/oVF86u'],['https://t.co/crKCgDL5Hi'],0,0,0,0,pt,"<a href=""https://www.google.com/"" rel=""nofollow"">Google</a>",,,,
81,2019-09-16 17:11:15+00:00,macroecon_dog,"Pq um jornalista ""sério"" escreve isso? ""sedentário"" é bem desnecessário
""Jogador d tênis e fã d tecnologia q vai p/ academia qse tds os dias e já estudou blockchain, Campos Neto representa um leve contraste em relação ao mais cerebral e sedentário antecessor Ilan Goldfajn(...)""",Economist Dog,"Economist at a HF. Covering Brazil, mainly.",False,13,441,134,35,0,25,,False,[],[],1,0,0,0,pt,"<a href=""https://mobile.twitter.com"" rel=""nofollow"">Twitter Web App</a>",,,,
82,2019-09-14 23:26:14+00:00,politicasemfato,Ilan Goldfajn nega estar colaborando com a campanha Ciro Gomes,PolíticasemFato,"Cansado de fake news viesadas, pagas por partidos políticos? Bem-vindo à PolíticasemFato, a primeira agência de fake news política 100% isenta e imparcial.",False,2777,60,78083,560,9,80,"Rua da Assembléia, 10",False,[],[],0,0,0,0,pt,"<a href=""http://twitter.com/politicasemfato"" rel=""nofollow"">politicasemfato</a>",,,,
83,2019-09-12 05:26:14+00:00,politicasemfato,Ilan Goldfajn e Vinicius Carrasco estão auxiliando Manuela d'Ávila no plano de governo.,PolíticasemFato,"Cansado de fake news viesadas, pagas por partidos políticos? Bem-vindo à PolíticasemFato, a primeira agência de fake news política 100% isenta e imparcial.",False,2777,60,78083,560,9,80,"Rua da Assembléia, 10",False,[],[],0,0,0,0,pt,"<a href=""http://twitter.com/politicasemfato"" rel=""nofollow"">politicasemfato</a>",,,,
84,2019-09-10 01:23:24+00:00,dfugita,"@longshott @jairbolsonaro Esse Guedes está virando uma decepção. Chama outro , Bolso. Chama o Ilan Goldfajn pro lugar do Guedes",dfugit,Que Deus proteja o Brasil da Esquerda.,False,1683,5001,90884,50882,2,954,Monte Alto,False,[],[],0,0,0,0,pt,"<a href=""https://mobile.twitter.com"" rel=""nofollow"">Twitter Web App</a>",,,,"[User(username='longshott', id=29109667, displayname='Robson Rezende🔞', rawDescription=None, renderedDescription=None, descriptionLinks=None, verified=None, created=None, followersCount=None, friendsCount=None, statusesCount=None, favouritesCount=None, listedCount=None, mediaCount=None, location=None, protected=None, link=None, profileImageUrl=None, profileBannerUrl=None, label=None), User(username='jairbolsonaro', id=128372940, displayname='Jair M. Bolsonaro', rawDescription=None, renderedDescription=None, descriptionLinks=None, verified=None, created=None, followersCount=None, friendsCount=None, statusesCount=None, favouritesCount=None, listedCount=None, mediaCount=None, location=None, protected=None, link=None, profileImageUrl=None, profileBannerUrl=None, label=None)]"
85,2019-09-07 21:44:55+00:00,oliferlj,Ilan Goldfajn vai assumir a presidência do conselho do Credit Suisse no Brasil https://t.co/P951eRz3Wc via @EstadaoEconomia,Jorge F. Oliveira 🇺🇦,,False,8,679,73814,104351,0,4177,Brazil,False,"['https://economia.estadao.com.br/noticias/geral,ilan-goldfajn-vai-assumir-a-presidencia-do-conselho-do-credit-suisse-no-brasil,70002998247']",['https://t.co/P951eRz3Wc'],0,0,0,0,pt,"<a href=""http://twitter.com"" rel=""nofollow"">Twitter Web Client</a>",,,,"[User(username='EstadaoEconomia', id=78774644, displayname='Economia Estadão', rawDescription=None, renderedDescription=None, descriptionLinks=None, verified=None, created=None, followersCount=None, friendsCount=None, statusesCount=None, favouritesCount=None, listedCount=None, mediaCount=None, location=None, protected=None, link=None, profileImageUrl=None, profileBannerUrl=None, label=None)]"
86,2019-09-06 14:23:06+00:00,farialimanews,"Nesta quinta-feira, o Credit Suisse Brasil anunciou Ilan Goldfajn, ex-presidente do Banco Central, como seu novo presidente do Conselho. Ilan deverá participar nas decisões estratégicas e na expansão do banco em território nacional.

Fonte: Faria Lima News https://t.co/pksjLVFnCu",farialimanews,"Saiba o que realmente importa! As principais notícias que impactam o mercado financeiro, diretamente na sua timeline.",False,117,8,357,10,0,352,Faria lima,False,[],[],0,0,0,0,pt,"<a href=""http://twitter.com/download/android"" rel=""nofollow"">Twitter for Android</a>","[Photo(previewUrl='https://pbs.twimg.com/media/EDyaARCXsAEbzuw?format=jpg&name=small', fullUrl='https://pbs.twimg.com/media/EDyaARCXsAEbzuw?format=jpg&name=large', altText=None)]",,,
87,2019-09-06 05:48:02+00:00,vonivar,Ilan Goldfajn assumirá presidência do conselho do Credit Suisse no Brasil - G1 https://t.co/VF77WYkkyL https://t.co/TaWgyl1vXH,vonivar,Jornalista e Consultor,False,2906,2192,1093255,10785,225,486002,"Goiânia, Goiás, Brasil",False,['http://dlvr.it/RCZBTQ'],['https://t.co/VF77WYkkyL'],0,0,0,0,pt,"<a href=""https://dlvrit.com/"" rel=""nofollow"">dlvr.it</a>","[Photo(previewUrl='https://pbs.twimg.com/media/EDwkHwGU4AAXOY9?format=jpg&name=small', fullUrl='https://pbs.twimg.com/media/EDwkHwGU4AAXOY9?format=jpg&name=large', altText=None)]",,,
88,2019-09-06 01:00:00+00:00,EstadaoEconomia,"Ilan Goldfajn vai assumir a presidência do conselho do Credit Suisse no Brasil - https://t.co/hUsjsNTEta 

Foto: Dida Sampaio/ Estadão https://t.co/BTMaUESUM2",Economia Estadão,Twitter do site Economia & Negócios do Estadão,True,441584,128,45962,36,2736,22109,,False,['http://bit.ly/2k6Qf7q'],['https://t.co/hUsjsNTEta'],0,2,15,3,pt,"<a href=""https://ads-api.twitter.com"" rel=""nofollow"">Twitter for Advertisers.</a>","[Photo(previewUrl='https://pbs.twimg.com/media/EDuI6UJWwAAj4H7?format=jpg&name=small', fullUrl='https://pbs.twimg.com/media/EDuI6UJWwAAj4H7?format=jpg&name=large', altText=None)]",,,
89,2019-09-06 00:45:20+00:00,PortalVarada,Ilan Goldfajn assumirá presidência do conselho do Credit Suisse no Brasil https://t.co/uoES1TBfbm https://t.co/SQUEkos26V,Portal Varada,,False,137,150,86839,74,0,19624,"Teresina, Brasil",False,['https://portalvarada.com/ilan-goldfajn-assumira-presidencia-do-conselho-do-credit-suisse-no-brasil/'],['https://t.co/uoES1TBfbm'],0,0,0,0,pt,"<a href=""http://publicize.wp.com/"" rel=""nofollow"">Jetpack.com</a>","[Photo(previewUrl='https://pbs.twimg.com/media/EDve1sqWsAImLEY?format=jpg&name=small', fullUrl='https://pbs.twimg.com/media/EDve1sqWsAImLEY?format=jpg&name=large', altText=None)]",,,
90,2019-09-05 20:51:41+00:00,VEJA,Ilan Goldfajn assumirá presidência do conselho do Credit Suisse no Brasil https://t.co/5vtNn7PlV1,VEJA,"O Brasil está mudando. O tempo todo. Fique por dentro! Assine a partir de R$2/semana: abr.ai/3Ypvnqe

Siga VEJA no Telegram: t.me/vejaoficial",True,9103414,27,368250,243,18029,68924,Brazil,False,['https://wp.me/p7qnr3-dpbq'],['https://t.co/5vtNn7PlV1'],0,4,21,0,pt,"<a href=""http://publicize.wp.com/"" rel=""nofollow"">Jetpack.com</a>",,,,
91,2019-09-05 20:10:04+00:00,Poder360,"Ex-presidente do Banco Central, Ilan Goldfajn assumirá a presidência do Conselho do Credit Suisse no Brasil

https://t.co/OHM079gnbh",Poder360,"Jornal digital: síntese inteligente, sem abreviação. Jornalismo profissional, política e poder, a partir de Brasília.

➡️ Acompanhe no Telegram: t.me/Poder360",True,137281,2017,118198,371,1236,46515,"Brasília, Brasil",False,['https://poder360.com.br/economia/ilan-goldfajn-assumira-a-presidencia-do-conselho-do-credit-suisse-no-brasil/'],['https://t.co/OHM079gnbh'],0,2,7,0,pt,"<a href=""https://www.facebook.com/socialmlabs/"" rel=""nofollow"">mLabs - Gestão de Redes Sociais</a>",,,,
92,2019-09-05 20:08:11+00:00,nomelouco37,"E pra galera que repete feito marreco quebrado ""A história cobrará"":

O final do Guedes será muito parecido com Ilan Goldfajn e da Maria Silvia Bastos Marques -  Esperar a chamada ""Quarentena"" pra nadar de braçada no mercado privado com suas posições estratégicas.",Celia Sanchez,"Célia é uma militante Cubana incrível, mas eu mesmo sou a Priscylla. Uma mulher do interior do MS.",False,19760,902,90397,96211,88,6764,,False,[],[],0,1,27,0,pt,"<a href=""http://twitter.com/download/android"" rel=""nofollow"">Twitter for Android</a>",,,,
93,2019-09-05 18:10:05+00:00,therezafontoura,"@eikebatista Poder 360 diz q Ilan Goldfajn assumirá a presidência do conselho do Credit Suisse no Brasil. Ilan ingressará no banco em 16 de setembro. Segundo nota da instituição financeira, Ilan ajudará no desenvolvimento das áreas de Wealth Management e Investment Banking.",Thereza Fontoura,"Economista , botafoguense , carioca",False,366,194,932635,374279,0,137562,,False,[],[],0,0,0,0,pt,"<a href=""https://mobile.twitter.com"" rel=""nofollow"">Twitter Web App</a>",,,,"[User(username='eikebatista', id=119064111, displayname='Eike Batista Oficial', rawDescription=None, renderedDescription=None, descriptionLinks=None, verified=None, created=None, followersCount=None, friendsCount=None, statusesCount=None, favouritesCount=None, listedCount=None, mediaCount=None, location=None, protected=None, link=None, profileImageUrl=None, profileBannerUrl=None, label=None)]"
94,2019-09-05 17:50:19+00:00,salvadordez,Ilan Goldfajn assumirá presidência do conselho do Credit Suisse no Brasil - https://t.co/AcIgIuek4Y,Portal Salvador Dez,O seu portal de notícias! - salvadordez.net,False,2469,1,341906,3,18,7050,Teh internets,False,['https://www.salvadordez.net/noticia/118290'],['https://t.co/AcIgIuek4Y'],0,0,0,0,pt,"<a href=""http://www.salvadordez.com.br"" rel=""nofollow"">PortalSalvadorDez</a>",,,,
95,2019-09-05 17:40:33+00:00,BahiaNoticias,Ilan Goldfajn assumirá presidência do conselho do Credit Suisse no Brasil https://t.co/s7J1huDqRA https://t.co/H5cNqPTT0o,Bahia Notícias,"Fique muito bem informado sobre o que acontece na Bahia, no Brasil e no mundo. 📸 instagram.com/bahianoticias",True,341211,485,271978,1434,593,120275,"Salvador, Brasil",False,['http://dlvr.it/RCXkSy'],['https://t.co/s7J1huDqRA'],0,0,1,0,pt,"<a href=""https://dlvrit.com/"" rel=""nofollow"">dlvr.it</a>","[Photo(previewUrl='https://pbs.twimg.com/media/EDt9nKiUUAARk-s?format=jpg&name=small', fullUrl='https://pbs.twimg.com/media/EDt9nKiUUAARk-s?format=jpg&name=large', altText=None)]",,,
96,2019-09-05 17:30:58+00:00,o_antagonista,"Ilan Goldfajn, que comandou o Banco Central, é o novo presidente do Conselho de Administração do Credit Suisse no Brasil. https://t.co/Qx0n3eRmNa",O Antagonista,O site de política mais influente do Brasil,True,1802284,1367,234090,14164,3646,32914,,False,['https://www.oantagonista.com/economia/goldfajn-no-credit-suisse/'],['https://t.co/Qx0n3eRmNa'],8,16,138,0,pt,"<a href=""https://about.twitter.com/products/tweetdeck"" rel=""nofollow"">TweetDeck</a>",,,,
97,2019-09-05 16:35:46+00:00,Grupodobemestar,"Ex-presidente do Banco Central,Ilan Goldfajn assume Conselho do Credit Suisse Brasil. Quais os limites éticos para funcionários públicos detentores de informações privilegiadas e influência trabalharem para iniciativa privada?https://t.co/MmgWw1em9e #Universidade #USP #ENEM #BC https://t.co/9YIrhePHhx",Grupo do bem estar,"Pessoas que se encontram para colocar a ARTE, A CIÊNCIA HUMANISTA, o PROTAGONISMO CIDADÃO e a ESPIRITUALIDADE a serviço do BEM ESTAR e da FELICIDADE.",False,1365,16,54717,3762,74,50217,"São Paulo, BRASIL",False,['https://www.infomoney.com.br/negocios/noticia/9287289/ilan-goldfajn-assume-conselho-do-credit-suisse-no-brasil-'],['https://t.co/MmgWw1em9e'],0,0,0,0,pt,"<a href=""https://mobile.twitter.com"" rel=""nofollow"">Twitter Web App</a>","[Photo(previewUrl='https://pbs.twimg.com/media/EDtuyC-XsAAdtDu?format=jpg&name=small', fullUrl='https://pbs.twimg.com/media/EDtuyC-XsAAdtDu?format=jpg&name=large', altText=None)]",,,
98,2019-09-05 16:35:10+00:00,Grupodobemestar,"Ex-presidente do Banco Central,Ilan Goldfajn assume Conselho do Credit Suisse Brasil. Quais os limites éticos para funcionários públicos detentores de informações privilegiadas e influência trabalharem para iniciativa privada?https://t.co/MmgWw1em9e #Educação #Cultura #Arte #MPF https://t.co/ac2AL1pI4A",Grupo do bem estar,"Pessoas que se encontram para colocar a ARTE, A CIÊNCIA HUMANISTA, o PROTAGONISMO CIDADÃO e a ESPIRITUALIDADE a serviço do BEM ESTAR e da FELICIDADE.",False,1365,16,54717,3762,74,50217,"São Paulo, BRASIL",False,['https://www.infomoney.com.br/negocios/noticia/9287289/ilan-goldfajn-assume-conselho-do-credit-suisse-no-brasil-'],['https://t.co/MmgWw1em9e'],0,0,0,0,pt,"<a href=""https://mobile.twitter.com"" rel=""nofollow"">Twitter Web App</a>","[Photo(previewUrl='https://pbs.twimg.com/media/EDtupFMWwAEUKNl?format=jpg&name=small', fullUrl='https://pbs.twimg.com/media/EDtupFMWwAEUKNl?format=jpg&name=large', altText=None)]",,,
99,2019-09-05 16:34:34+00:00,Grupodobemestar,"Ex-presidente do Banco Central,Ilan Goldfajn assume Conselho do Credit Suisse Brasil. Quais os limites éticos para funcionários públicos detentores de informações privilegiadas e influência trabalharem para iniciativa privada?https://t.co/MmgWw1em9e #Ética #Investimentos #Bancos https://t.co/Wc6yKQAN4a",Grupo do bem estar,"Pessoas que se encontram para colocar a ARTE, A CIÊNCIA HUMANISTA, o PROTAGONISMO CIDADÃO e a ESPIRITUALIDADE a serviço do BEM ESTAR e da FELICIDADE.",False,1365,16,54717,3762,74,50217,"São Paulo, BRASIL",False,['https://www.infomoney.com.br/negocios/noticia/9287289/ilan-goldfajn-assume-conselho-do-credit-suisse-no-brasil-'],['https://t.co/MmgWw1em9e'],0,0,0,0,pt,"<a href=""https://mobile.twitter.com"" rel=""nofollow"">Twitter Web App</a>","[Photo(previewUrl='https://pbs.twimg.com/media/EDtugboW4AA8oyC?format=jpg&name=small', fullUrl='https://pbs.twimg.com/media/EDtugboW4AA8oyC?format=jpg&name=large', altText=None)]",,,
