,datetime,username,content,display name,user description,verified,follower count,friends count,statuses count,favourites count,listed count,media count,location,protected,outlinks,tcooutlinks,reply count,retweet count,like count,quote count,lang,source,media,retweeted tweet,quoted tweet,mentioned users
313,2020-04-28 19:47:39+00:00,gabreconomics,"Aulão do Ilan Goldfajn, ex-presidente do BC, explicando como funciona a emissão de moeda. 
“A emissão monetária no mundo de hoje é um passivo, é uma dívida do Banco Central que tem um mesmo custo de uma dívida do Tesouro indexada.” https://t.co/8lLCV6dAlE",Gabriel S.,Mestrando na área de Finanças e Mercados Financeiros e Economista pela Universidade Federal do Paraná (UFPR).,False,2740,1026,1681,7472,11,266,"Curitiba, Brasil",False,[],[],1,0,0,1,pt,"<a href=""http://twitter.com/download/iphone"" rel=""nofollow"">Twitter for iPhone</a>","[Video(thumbnailUrl='https://pbs.twimg.com/ext_tw_video_thumb/1255221610577121282/pu/img/VtsolS3kRrIWE8zZ.jpg', variants=[VideoVariant(url='https://video.twimg.com/ext_tw_video/1255221610577121282/pu/pl/MI-HyBuBGK4VE0rm.m3u8?tag=10', contentType='application/x-mpegURL', bitrate=None), VideoVariant(url='https://video.twimg.com/ext_tw_video/1255221610577121282/pu/vid/1280x720/yi7kN3TZSWGqY6He.mp4?tag=10', contentType='video/mp4', bitrate=2176000), VideoVariant(url='https://video.twimg.com/ext_tw_video/1255221610577121282/pu/vid/640x360/k7_5THVERTuMKFuB.mp4?tag=10', contentType='video/mp4', bitrate=832000), VideoVariant(url='https://video.twimg.com/ext_tw_video/1255221610577121282/pu/vid/480x270/nhOs1km2O7JOuiyc.mp4?tag=10', contentType='video/mp4', bitrate=256000)], duration=140.018, views=60, altText=None)]",,,
314,2020-04-28 19:37:11+00:00,sgoldenstein,"Apresentação bastante didática do Ilan Goldfajn sobre política monetária. Recomendo!

https://t.co/xiZ2jq3JTl",Sergio Goldenstein,"Flamenguista, antiextremista e humanista.
Mestre em Economia, ex-chefe do Dpto de Mercado Aberto (Demab) do BC.
Opiniões pessoais.",False,13463,1229,4209,10750,216,427,Rio de Janeiro,False,['https://www.linkedin.com/posts/sergio-goldenstein-27b68518_pol%C3%ADtica-monet%C3%A1ria-na-pandemia-ilan-goldfajn-activity-6660980109408817152-kK-w'],['https://t.co/xiZ2jq3JTl'],0,0,7,0,pt,"<a href=""http://twitter.com/download/android"" rel=""nofollow"">Twitter for Android</a>",,,,
315,2020-04-28 18:09:34+00:00,drunkeynesian,"Ótima apresentação (sobretudo as perguntas e respostas) do Ilan Goldfajn sobre política monetária no combante aos efeitos da pandemia:

https://t.co/dxAvBSb2yb",Drunkeynesian,"Economist, married to data but frequently flirting with seductive narratives. Macro, dev't, mkts, travel, jazz & books. More drunk than keynesian. Proud MPA/ID.",False,26895,1712,47486,718,406,2589,"Sao Paulo, Brazil",False,['https://www.dropbox.com/s/0zly3yw97quxjc7/Politica_Monetaria_IG_Abr2020.pdf?dl=0'],['https://t.co/dxAvBSb2yb'],1,2,27,1,pt,"<a href=""https://mobile.twitter.com"" rel=""nofollow"">Twitter Web App</a>",,,,
316,2020-04-28 16:31:58+00:00,vncarrasco,Espetacular apresentaçãode Ilan Goldfajn. Não se enganem: não há mágica: https://t.co/R9bgNZFtbD…,Vinicius Carrasco,"Economist with interests in Market and Mechanism Design, Corporate Finance and Industrial Organization. Views are my own.",False,5698,1221,12532,3836,89,235,,False,['http://m.youtube.com/watch?v=XuyxNZ'],['https://t.co/R9bgNZFtbD'],7,10,80,1,pt,"<a href=""http://twitter.com/download/iphone"" rel=""nofollow"">Twitter for iPhone</a>",,,,
317,2020-04-28 15:59:14+00:00,MarcioGPGarcia,"Para os interessados, seminário do qual participei com Ilan Goldfajn, sobre Política Monetária na Pandemia: https://t.co/pwOqD5lm6a",Marcio Garcia,"Professor titular de Economia, PUC-Rio. Pesquisador em finanças internacionais, economia monetária e bancária. Brasileiro e botafoguense obstinado.",False,599,109,86,29,4,4,"Rio de Janeiro, Brazil",False,['https://m.youtube.com/watch?v=Og20NpJrBjM'],['https://t.co/pwOqD5lm6a'],0,0,1,0,pt,"<a href=""http://twitter.com/download/iphone"" rel=""nofollow"">Twitter for iPhone</a>",,,,
318,2020-04-28 09:06:22+00:00,politicasemfato,"Ilan Goldfajn: ""estou em casa, cumprindo meu papel #FiqueEmCasa""",PolíticasemFato,"Cansado de fake news viesadas, pagas por partidos políticos? Bem-vindo à PolíticasemFato, a primeira agência de fake news política 100% isenta e imparcial.",False,2777,60,78083,560,9,80,"Rua da Assembléia, 10",False,[],[],0,0,0,0,pt,"<a href=""http://twitter.com/politicasemfato"" rel=""nofollow"">politicasemfato</a>",,,,
319,2020-04-27 15:36:13+00:00,jlspbr,"**IlanGoldfajn
Não é momento de grandesplanos, obras públicas,focotem de ser nos vulneráveis https://t.co/qhswVTDUCu",@jlspbr👓,NÓS TODOS SOMOS ORGANIZADOS DE MODO DIFERENTE-BYRON/🔬SEM POLÍTICO DE ESTIMAÇÃO /💯 SP ⛾ 🛵,False,1352,4996,53901,41101,30,22290,"São Paulo, Brasil",False,[],[],0,0,0,0,pt,"<a href=""http://twitter.com/download/android"" rel=""nofollow"">Twitter for Android</a>","[Photo(previewUrl='https://pbs.twimg.com/media/EWnuw5mXYAET3EU?format=jpg&name=small', fullUrl='https://pbs.twimg.com/media/EWnuw5mXYAET3EU?format=jpg&name=large', altText=None)]",,,
320,2020-04-27 15:33:37+00:00,jlspbr,"**IlanGoldfajn
Ex-presidente do BC critica voluntarismo do plano Pró-Brasil e dizque tomar medidas incorretas pode comprometer a próxima década- @folha

@tarcisiogdf",@jlspbr👓,NÓS TODOS SOMOS ORGANIZADOS DE MODO DIFERENTE-BYRON/🔬SEM POLÍTICO DE ESTIMAÇÃO /💯 SP ⛾ 🛵,False,1352,4996,53901,41101,30,22290,"São Paulo, Brasil",False,[],[],1,0,0,0,pt,"<a href=""http://twitter.com/download/android"" rel=""nofollow"">Twitter for Android</a>",,,,"[User(username='folha', id=14594813, displayname='Folha de S.Paulo', rawDescription=None, renderedDescription=None, descriptionLinks=None, verified=None, created=None, followersCount=None, friendsCount=None, statusesCount=None, favouritesCount=None, listedCount=None, mediaCount=None, location=None, protected=None, link=None, profileImageUrl=None, profileBannerUrl=None, label=None), User(username='tarcisiogdf', id=1078618844007157761, displayname='Tarcísio Gomes de Freitas', rawDescription=None, renderedDescription=None, descriptionLinks=None, verified=None, created=None, followersCount=None, friendsCount=None, statusesCount=None, favouritesCount=None, listedCount=None, mediaCount=None, location=None, protected=None, link=None, profileImageUrl=None, profileBannerUrl=None, label=None)]"
321,2020-04-27 13:49:20+00:00,msantoro1978,"Boa entrevista de Ilan Goldfajn explicando por que foco da política econômica de resposta à pandemia não deve ser grandes obras, mas proteção aos mais pobres e às pequenas empresas. https://t.co/fWdM7QroDg",Maurício Santoro,"Cientista político, gerente de advocacy, relações institucionais e assuntos humanitários de Médicos Sem Fronteiras - Brasil. Opiniões pessoais.",False,54575,96,37253,72,522,6585,Rio de Janeiro,False,['https://www1.folha.uol.com.br/mercado/2020/04/nao-e-hora-de-grandes-obras-publicas-diz-ex-presidente-do-bc.shtml'],['https://t.co/fWdM7QroDg'],0,7,29,1,pt,"<a href=""https://mobile.twitter.com"" rel=""nofollow"">Twitter Web App</a>",,,,
322,2020-04-27 13:36:56+00:00,MarcioOiticica,"#fiquesabendo 

Ilan Goldfajn, ex-presidente do BC, critica investimentos do Pró-Brasil https://t.co/oX6XS1u8Wl",Adm. Marcio Oiticica - Planejador Financeiro,,False,415,1771,7142,410,2,198,Salvador,False,['https://lnkd.in/e43VF5h'],['https://t.co/oX6XS1u8Wl'],0,0,0,0,pt,"<a href=""http://www.linkedin.com/"" rel=""nofollow"">LinkedIn</a>",,,,
323,2020-04-27 13:31:29+00:00,euqueroinvestir,"Ilan Goldfajn, ex-presidente do BC, critica investimentos do Pró-Brasil
#fintwit #fintwitBR
https://t.co/WL4MMhDsUo",EuQueroInvestir,Somos um site de educação financeira e nosso foco é te ensinar a investir 📊,False,6954,83,26530,718,89,505,"Balneário Camboriú, Brasil",False,['http://zpr.io/tdHjc'],['https://t.co/WL4MMhDsUo'],0,0,0,0,pt,"<a href=""https://zapier.com/"" rel=""nofollow"">Zapier.com</a>",,,,
324,2020-04-27 11:44:10+00:00,Jornal_Canyons,"👉 Também na Folha: Ilan Goldfajn: não é o momento de grandes planos e obras públicas

👉 Também na Folha: Mortes de jovens por coronavírus aumentam // A quantidade de óbitos entre homens e mulheres com menos de 60 anos cresceu cerca de 64 vezes em menos de um mês.",Jornal dos Canyons,"#JornaldosCanyons, o Diário Digital da #CapitaldosCanyons → #Política, #Economia & #Tecnologia ≡ #JdC",False,451,0,74474,6,23,7818,"Praia Grande, Brasil",False,[],[],1,0,1,0,pt,"<a href=""http://twitter.com/download/android"" rel=""nofollow"">Twitter for Android</a>",,,,
325,2020-04-27 10:35:05+00:00,leobudget,"Combinando minha Thread do final de semana, onde explico a importância de se fomentar investimentos em infraestrutura com apoio do setor público, com a entrevista do Ilan Goldfajn.

https://t.co/P0BCiXhfr8",Leonardo Ribeiro,Analista legislativo do Senado. Um dos idealizadores do Marco Regulatório das Ferrovias e @ifibrasil. Mestre em Economia c/ Visiting Scholar @victoriauninews,False,5590,836,12578,15728,59,806,"Brasília, Brasil",False,['https://twitter.com/leobudget/status/1254717920183226368?s=21'],['https://t.co/P0BCiXhfr8'],0,0,0,0,pt,"<a href=""http://twitter.com/download/iphone"" rel=""nofollow"">Twitter for iPhone</a>",,,https://twitter.com/threadreaderapp/status/1254062389013643264,
326,2020-04-26 16:07:24+00:00,politicasemfato,"Ilan Goldfajn: ""Nelson Marconi propôs 50 por mês, pois eu proponho 500 reais""",PolíticasemFato,"Cansado de fake news viesadas, pagas por partidos políticos? Bem-vindo à PolíticasemFato, a primeira agência de fake news política 100% isenta e imparcial.",False,2777,60,78083,560,9,80,"Rua da Assembléia, 10",False,[],[],0,0,0,0,pt,"<a href=""http://twitter.com/politicasemfato"" rel=""nofollow"">politicasemfato</a>",,,,
327,2020-04-26 09:37:21+00:00,politicasemfato,"Ilan Goldfajn me chamou pra sua festa, mas achei melhor não ir dado o que está acontecendo"", afirmou Pedro Malan por telefone",PolíticasemFato,"Cansado de fake news viesadas, pagas por partidos políticos? Bem-vindo à PolíticasemFato, a primeira agência de fake news política 100% isenta e imparcial.",False,2777,60,78083,560,9,80,"Rua da Assembléia, 10",False,[],[],0,0,0,0,pt,"<a href=""http://twitter.com/politicasemfato"" rel=""nofollow"">politicasemfato</a>",,,,
328,2020-04-24 07:36:21+00:00,politicasemfato,"Ilan Goldfajn: ""A verdade é que o Banco Central está demorando para agir""",PolíticasemFato,"Cansado de fake news viesadas, pagas por partidos políticos? Bem-vindo à PolíticasemFato, a primeira agência de fake news política 100% isenta e imparcial.",False,2777,60,78083,560,9,80,"Rua da Assembléia, 10",False,[],[],0,0,1,1,pt,"<a href=""http://twitter.com/politicasemfato"" rel=""nofollow"">politicasemfato</a>",,,,
329,2020-04-24 04:36:21+00:00,politicasemfato,"Ilan Goldfajn: ""Já passou da hora de o Banco Central cortar a SELIC""",PolíticasemFato,"Cansado de fake news viesadas, pagas por partidos políticos? Bem-vindo à PolíticasemFato, a primeira agência de fake news política 100% isenta e imparcial.",False,2777,60,78083,560,9,80,"Rua da Assembléia, 10",False,[],[],0,0,0,0,pt,"<a href=""http://twitter.com/politicasemfato"" rel=""nofollow"">politicasemfato</a>",,,,
330,2020-04-24 02:36:21+00:00,politicasemfato,"'Não sei, pô', diz Ilan Goldfajn sobre se aceitará indicações políticas para cargos do governo",PolíticasemFato,"Cansado de fake news viesadas, pagas por partidos políticos? Bem-vindo à PolíticasemFato, a primeira agência de fake news política 100% isenta e imparcial.",False,2777,60,78083,560,9,80,"Rua da Assembléia, 10",False,[],[],0,0,0,0,pt,"<a href=""http://twitter.com/politicasemfato"" rel=""nofollow"">politicasemfato</a>",,,,
331,2020-04-24 00:55:06+00:00,JoaoPauloJM,"@eruilluviel O Ilan Goldfajn em 2013 já dava as linhas do que seria se a turma fiscalista assumisse. É pra desaquecer o mercado de trabalho.
https://t.co/Ycy87nakHF",João Paulo🚩,Viver significa tomar partido -,False,631,1250,32296,198716,5,4300,São Paulo - SP,False,['https://www.itau.com.br/itaubba-pt/analises-economicas/publicacoes/nossos-artigos/combater-a-inflacao-mexer-no-emprego-de-ilan-goldfajn'],['https://t.co/Ycy87nakHF'],0,0,1,0,pt,"<a href=""http://twitter.com/download/android"" rel=""nofollow"">Twitter for Android</a>",,,,"[User(username='eruilluviel', id=2820634824, displayname='Belmiro', rawDescription=None, renderedDescription=None, descriptionLinks=None, verified=None, created=None, followersCount=None, friendsCount=None, statusesCount=None, favouritesCount=None, listedCount=None, mediaCount=None, location=None, protected=None, link=None, profileImageUrl=None, profileBannerUrl=None, label=None)]"
332,2020-04-23 20:15:13+00:00,Insper,"Os economistas José Alexandre Scheinkman, Ilan Goldfajn e Marcos Lisboa estarão juntos webinar promovido pelo Insper amanhã, dia 24/04, ao meio-dia. Faça sua inscrição e participe da agenda que reúne três grandes nomes da economia: https://t.co/4nFtzuXBib https://t.co/TvArdESkhV",Insper,"Instituição sem fins lucrativos, dedicada ao ensino e à pesquisa. Oferecemos cursos de graduação, pós-graduação, educação executiva e customizados.",False,29717,205,13321,2036,246,4556,São Paulo | Brasil,False,['https://bit.ly/2VTSsBL'],['https://t.co/4nFtzuXBib'],5,3,12,0,pt,"<a href=""https://mobile.twitter.com"" rel=""nofollow"">Twitter Web App</a>","[Photo(previewUrl='https://pbs.twimg.com/media/EWUIKilUMAElBRA?format=jpg&name=small', fullUrl='https://pbs.twimg.com/media/EWUIKilUMAElBRA?format=jpg&name=large', altText=None)]",,,
333,2020-04-23 02:36:21+00:00,politicasemfato,"Elena Landau: ""Ilan Goldfajn propôs 99 por mês, pois eu proponho 3.400 reais""",PolíticasemFato,"Cansado de fake news viesadas, pagas por partidos políticos? Bem-vindo à PolíticasemFato, a primeira agência de fake news política 100% isenta e imparcial.",False,2777,60,78083,560,9,80,"Rua da Assembléia, 10",False,[],[],0,0,0,0,pt,"<a href=""http://twitter.com/politicasemfato"" rel=""nofollow"">politicasemfato</a>",,,,
334,2020-04-22 14:33:27+00:00,luizhfmarins,"Dos países do BRICS, só o Real está desvalorizando frente ao dólar. E é uma baita desvalorização. 

Saudades do Ilan Goldfajn resolvendo esses pepinos...",Luiz Henrique,"Aqui falamos de futebol (com ênfase no Santos FC), automobilismo, política, economia, cinema e tudo o que eu acho que entendo.",False,78,440,6973,36595,0,450,,False,[],[],0,0,1,0,pt,"<a href=""http://twitter.com/download/android"" rel=""nofollow"">Twitter for Android</a>",,,,
335,2020-04-21 11:51:18+00:00,FEBRABAN,"Na última sexta-feira, os principais executivos de alguns dos maiores bancos do País participam de uma live moderada por Ilan Goldfajn. Apesar das previsões de recessão, eles também ressaltaram que o Brasil possui pontos fortes para enfrentar a crise. Confira o que eles disseram https://t.co/vQ6BjrTC7Z",FEBRABAN,Twitter oficial da FEBRABAN - Federação Brasileira de Bancos - principal entidade representativa do setor bancário no País.,True,49451,252,12793,382,269,2560,"São Paulo, Brazil",False,[],[],2,2,7,0,pt,"<a href=""https://mobile.twitter.com"" rel=""nofollow"">Twitter Web App</a>","[Photo(previewUrl='https://pbs.twimg.com/media/EWIBn5NWAAM8xE4?format=jpg&name=small', fullUrl='https://pbs.twimg.com/media/EWIBn5NWAAM8xE4?format=jpg&name=large', altText=None), Photo(previewUrl='https://pbs.twimg.com/media/EWIBn70X0AAPOba?format=jpg&name=small', fullUrl='https://pbs.twimg.com/media/EWIBn70X0AAPOba?format=jpg&name=large', altText=None), Photo(previewUrl='https://pbs.twimg.com/media/EWIBn72WAAUGQBN?format=jpg&name=small', fullUrl='https://pbs.twimg.com/media/EWIBn72WAAUGQBN?format=jpg&name=large', altText=None)]",,,
336,2020-04-21 00:10:34+00:00,duduzil,"Mais um seminário virtual do Departamento de Economia da PUC-Rio, agora sobre política monetária na pandemia, com Ilan Goldfajn e Marcio Garcia.",Eduardo Zilberman,(Macro)economist. Views are my own.,False,3606,512,719,1252,42,54,Rio de Janeiro,False,[],[],0,1,39,1,pt,"<a href=""http://twitter.com/download/iphone"" rel=""nofollow"">Twitter for iPhone</a>",,,https://twitter.com/PUCRioEconomia/status/1252271798223339525,
337,2020-04-20 22:09:28+00:00,JoaoPauloJM,"Não bastasse tudo que tá ocorrendo no Brasil eu ainda fico fuçando na internet e acho um texto de 2013 do Ilan Goldfajn, sim ele mesmo, reclamando do desemprego baixo e da ""alta"" inflação. https://t.co/XhZylRjulT",João Paulo🚩,Viver significa tomar partido -,False,631,1250,32296,198716,5,4300,São Paulo - SP,False,[],[],1,0,0,0,pt,"<a href=""http://twitter.com/download/android"" rel=""nofollow"">Twitter for Android</a>","[Photo(previewUrl='https://pbs.twimg.com/media/EWFFpYdUcAAR7Ms?format=jpg&name=small', fullUrl='https://pbs.twimg.com/media/EWFFpYdUcAAR7Ms?format=jpg&name=large', altText=None)]",,,
338,2020-04-20 16:23:57+00:00,PUCRioEconomia,"Ciclo de Seminários Virtuais
Nesta quinta feira, 23 de abril às 18h teremos mais um seminário sobre os Desafios Econômicos da COVID 19
 
Márcio Garcia e Ilan Goldfajn, “Política Monetária na Pandemia”   
https://t.co/Bj6PN1KFhj

https://t.co/Vgl45nfywD",Departamento de Economia PUC-Rio,Departamento de Economia da PUC-Rio é  um dos mais conceituados centros de ensino e pesquisa em Economia na América Latina.,False,4148,4,560,21,40,133,Rio de Janeiro,False,"['http://www.puc-rio.br/ecoa/go#econ', 'http://www.econ.puc-rio.br/conteudo/show/716']","['https://t.co/Bj6PN1KFhj', 'https://t.co/Vgl45nfywD']",2,7,38,1,pt,"<a href=""https://mobile.twitter.com"" rel=""nofollow"">Twitter Web App</a>",,,,
339,2020-04-18 21:31:56+00:00,maauricio,"Painel com mediação do Ilan Goldfajn, que conta com a participação dos CEOs dos três maiores bancos do Brasil, Itaú, Bradesco e Santander. 

Imperdível!

https://t.co/AgKy1dnyAP",Mauricio Camargo,"Eu falo tu... política, futebol e outras coisas.. Empreendedor do ramo de café do sul de MG. instagram: mauriciocamargomc",False,1668,469,95145,79270,8,2166,Sul de MG,False,['https://www.youtube.com/watch?v=Fyc5drwr51g&feature=youtu.be'],['https://t.co/AgKy1dnyAP'],0,0,1,0,pt,"<a href=""https://mobile.twitter.com"" rel=""nofollow"">Twitter Web App</a>",,,,
340,2020-04-17 21:57:31+00:00,MeninRibeiro,"CEOs dos bancos discutem atuação na crise

Candido Bracher, CEO Itaú
Octavio de Lazari Júnior, CEO Bradesco
Sérgio Rial, CEO Santander

Moderação: Ilan Goldfajn, presidente do Conselho do Credit Suisse e ex-presidente do BC

Isso é uma live de respeito kkk https://t.co/ZsXwbkthuB",Pedro Menin,Founder @ Quantzed | QTZ Investimentos | Societário Academy - Ubi dubium ibi libertas 🇧🇷,False,29496,455,16171,6654,356,2905,"Maringá, Brasil",False,['https://www.youtube.com/watch?v=Fyc5drwr51g&feature=youtu.be'],['https://t.co/ZsXwbkthuB'],1,4,26,0,pt,"<a href=""https://mobile.twitter.com"" rel=""nofollow"">Twitter Web App</a>",,,,
341,2020-04-17 19:55:22+00:00,rbreia,"Hoje às 17h30
CEOs dos bancos discutem atuação na crise
Candido Bracher, CEO do Itaú Unibanco 
Octavio de Lazari Júnior, CEO do Bradesco  
Sérgio Rial CEO do Santander Brasil; 
Ilan Goldfajn, presidente do Conselho do Credit Suisse no Brasil.
https://t.co/fPBaYNcV8O","Renato Breia, CFP®",Sócio Fundador da Nord Research e Nord Wealth / 18 anos de mercado financeiro /Insta instagram.com/renatobreia,True,104786,1345,16298,33709,1148,3562,"Sao Paulo, Brazil",False,['https://www.youtube.com/watch?v=TJzUoMDjZPE&feature=youtu.be'],['https://t.co/fPBaYNcV8O'],0,2,20,0,pt,"<a href=""https://mobile.twitter.com"" rel=""nofollow"">Twitter Web App</a>",,,,
342,2020-04-17 14:47:22+00:00,EdsonLauFilho,"Recomendo demais esse debate promovido pela @fundacaofhc sobre as respostas que o Brasil pode dar na crise que atravessamos.

Participaram o CEO brasileiro do JP Morgan, José Berenger e os ex-presidentes do Banco Central, Armínio Fraga e Ilan Goldfajn.

https://t.co/zt8YJ4D31Z",Edson Lau,"Falo sobre esportes (pincipalmente futebol), política e religião, não necessariamente nessa mesma ordem.",False,1989,990,14804,4551,34,1061,Curitiba,False,['https://youtu.be/zgeFf2alhKM'],['https://t.co/zt8YJ4D31Z'],0,0,0,0,pt,"<a href=""http://twitter.com/download/iphone"" rel=""nofollow"">Twitter for iPhone</a>",,,,"[User(username='fundacaofhc', id=2688070376, displayname='Fundação FHC', rawDescription=None, renderedDescription=None, descriptionLinks=None, verified=None, created=None, followersCount=None, friendsCount=None, statusesCount=None, favouritesCount=None, listedCount=None, mediaCount=None, location=None, protected=None, link=None, profileImageUrl=None, profileBannerUrl=None, label=None)]"
343,2020-04-16 02:26:14+00:00,politicasemfato,"Yoshiaki Nakano: ""Ilan Goldfajn propôs 99 por mês, pois eu proponho 3.400 reais""",PolíticasemFato,"Cansado de fake news viesadas, pagas por partidos políticos? Bem-vindo à PolíticasemFato, a primeira agência de fake news política 100% isenta e imparcial.",False,2777,60,78083,560,9,80,"Rua da Assembléia, 10",False,[],[],0,0,0,0,pt,"<a href=""http://twitter.com/politicasemfato"" rel=""nofollow"">politicasemfato</a>",,,,
344,2020-04-15 16:26:14+00:00,politicasemfato,"Ilan Goldfajn: ""Zeina Latif propôs 50 por mês, pois eu proponho 500 reais""",PolíticasemFato,"Cansado de fake news viesadas, pagas por partidos políticos? Bem-vindo à PolíticasemFato, a primeira agência de fake news política 100% isenta e imparcial.",False,2777,60,78083,560,9,80,"Rua da Assembléia, 10",False,[],[],0,0,2,0,pt,"<a href=""http://twitter.com/politicasemfato"" rel=""nofollow"">politicasemfato</a>",,,,
345,2020-04-14 18:26:14+00:00,politicasemfato,"Ilan Goldfajn: ""José Marcio Camargo propôs 500 por mês, pois eu proponho 2.000 reais""",PolíticasemFato,"Cansado de fake news viesadas, pagas por partidos políticos? Bem-vindo à PolíticasemFato, a primeira agência de fake news política 100% isenta e imparcial.",False,2777,60,78083,560,9,80,"Rua da Assembléia, 10",False,[],[],0,0,0,0,pt,"<a href=""http://twitter.com/politicasemfato"" rel=""nofollow"">politicasemfato</a>",,,,
346,2020-04-14 16:36:17+00:00,4ventos,"Próximos seminários: Márcio Garcia e Ilan Goldfajn, Marcelo Medeiros e convidado, Arminio Fraga e Rudi Rocha, Claudio Ferraz e Filipe Campante, Thierry Verdier e convidado, Gustavo Gonzaga e convidado.  (...)",Igor Coura 🇺🇳,"Em defesa da razão, da ciência, do progresso da humanidade, e de políticas públicas pragmáticas e efetivas.",False,389,1891,6945,6973,2,806,"Belo Horizonte, MG - BR",False,[],[],1,0,0,0,pt,"<a href=""http://twitter.com/download/android"" rel=""nofollow"">Twitter for Android</a>",,,,
347,2020-04-10 17:56:14+00:00,politicasemfato,"Octavio de Barros: ""Ilan Goldfajn propôs 50 por mês, pois eu proponho 500 reais""",PolíticasemFato,"Cansado de fake news viesadas, pagas por partidos políticos? Bem-vindo à PolíticasemFato, a primeira agência de fake news política 100% isenta e imparcial.",False,2777,60,78083,560,9,80,"Rua da Assembléia, 10",False,[],[],0,0,0,0,pt,"<a href=""http://twitter.com/politicasemfato"" rel=""nofollow"">politicasemfato</a>",,,,
348,2020-04-09 18:56:14+00:00,politicasemfato,"""Acordei mal hoje. Não sei se é coronavirus ou só ressaca, mesmo"", tuitou Ilan Goldfajn",PolíticasemFato,"Cansado de fake news viesadas, pagas por partidos políticos? Bem-vindo à PolíticasemFato, a primeira agência de fake news política 100% isenta e imparcial.",False,2777,60,78083,560,9,80,"Rua da Assembléia, 10",False,[],[],0,1,2,0,pt,"<a href=""http://twitter.com/politicasemfato"" rel=""nofollow"">politicasemfato</a>",,,,
349,2020-04-08 14:56:14+00:00,politicasemfato,"Mangabeira Unger: ""Ilan Goldfajn propôs 50 por mês, pois eu proponho 500 reais""",PolíticasemFato,"Cansado de fake news viesadas, pagas por partidos políticos? Bem-vindo à PolíticasemFato, a primeira agência de fake news política 100% isenta e imparcial.",False,2777,60,78083,560,9,80,"Rua da Assembléia, 10",False,[],[],0,0,0,0,pt,"<a href=""http://twitter.com/politicasemfato"" rel=""nofollow"">politicasemfato</a>",,,,
350,2020-04-08 00:00:12+00:00,pedrouzae,Debate: Armínio Fraga e Ilan Goldfajn discutem sobre o comportamento do ... https://t.co/CD97LmCoQq via @YouTube,Pedro e Simone Uzae 🇧🇷SDV-24h🇧🇷 #DireitaUnida,SDV #DireitaUnida Sem contradição ainda estaríamos achando que o socialismo deu certo. É preciso atacar as ideias ñ as pessoas. Sou cristão e conservador..,False,1166,1639,27023,22456,0,8133,,False,['https://youtu.be/GjxDQ_0U6cQ'],['https://t.co/CD97LmCoQq'],0,0,0,0,pt,"<a href=""http://twitter.com"" rel=""nofollow"">Twitter Web Client</a>",,,,"[User(username='YouTube', id=10228272, displayname='YouTube', rawDescription=None, renderedDescription=None, descriptionLinks=None, verified=None, created=None, followersCount=None, friendsCount=None, statusesCount=None, favouritesCount=None, listedCount=None, mediaCount=None, location=None, protected=None, link=None, profileImageUrl=None, profileBannerUrl=None, label=None)]"
